Year,Game,Review
2016,Doom,"There were no doubts that Doom would play fast, look stunning, or be gory; the surprise is that Doom is as relevant, smart and self-aware as it is; merging old ideas with new ones; injecting its near-flawless shooter mechanics into a campaign that¡¦s impeccably refined, hilariously dumb and fiendishly moreish."
2016,Doom,"It's hard to imagine a better Doom game in 2016 than this exhilarating, darkly witty new take on id's classic."
2016,Doom,"Intelligent, involved, and relentlessly exhilarating, now, just as in '93, the most exciting FPS around is a game called Doom."
2016,Doom,"Intelligent, fresh and endlessly enjoyable, Doom is more than a tribute to its beloved progenitor. Taken in its own right, this is the most finely crafted, technically impressive pure shooter in over a decade, proving that id Software, even after 26 years, is an adept, sophisticated game-maker. It may not create the same tectonic shift in video game culture as its ancestor, but personally, I prefer this Doom to the original. By refining, meticulously, several age-old and taken-for-granted game mechanics, Doom proves that excitement, spectacle and even narrative cohesion can exist in games seemingly composed of the basest elements."
2016,Doom,"Overall I am completely satisfied with Doom. So far it has been my favourite third party AAA game of this console generation. I can¡¦t remember being this impressed with a first person shooter since BioShock Infinite, and even then I think I prefer this one."
2016,Doom,DOOM is a masterful reboot of one of the most important and legendary franchises in the history of games; bravo to id and Bethesda.
2016,Doom,"DOOM is a stupendously good package, filled with the best first person shooter action in recent history. DOOM is back ladies and gentlemen, and it is metal as all hell."
2016,Doom,"Doom is the best possible way to play, in 2016, something that was great in 1993. Unmissable."
2016,Doom,"Exactly the right amount of old and new, DOOM is an adrenaline rush that borders on overwhelming in the best possible way."
2016,Doom,"Doom's shimmering, bombastic combat is as absorbing as it is revelatory. [Aug 2016, p.100]"
2016,Doom,"An important, palate-cleansing release in a crowded genre, Doom is essential playing for anyone who registers as a shooter fan. Heed the call of the FPS daddy and get your ass to Mars, pronto.[July 2016, p.78]"
2016,Doom,"DOOM is the incarnation of classical and vintage FPS gameplay with some really interesting twists that convey even more substance and flavor to the game. DOOM has an uncompromised technical performance and a high replayability value plus a frantic. It¡¦s unfortunate that the old school multiplayer included feels like a lost opportunity. Nevertheless, the whole package pulses with energy and adrenaline. Try it on the higher difficulty settings and feel the wrath of Hell."
2016,Doom,"Despite a troubled development, Doom is a confident, cracking throwback that pays loving tribute to its much-vaunted forefathers while bringing the noise via cutting edge tech. In a world awash with sci-fi hitscan shooters, it's a breath of fiery air that will delight as it melts faces."
2016,Doom,Doom is back on next-gen consoles and it's definitely a worthy reboot in every sense!
2016,Doom,DOOM is hands-down one of the best reimagined and exciting FPS games this generation.
2016,Doom,"DOOM may become repetitious near the end and doesn't take needed risks with mission variety, but it boasts some of the finest shooting mechanics and thoughtful levels we've seen in a first-person shooter in years, pushing it to the very fringes of excellence. The campaign's a head-banging, heavy metal hoot with a surprisingly good backstory, striking visuals, and two decent multiplayer-minded modes to back it up."
2016,Doom,"A confident resurgence of one of the FPS genre¡¦s pioneering efforts; DOOM not only manages to boast perhaps the finest single-player campaign in the genre but also a blissfully entertaining multiplayer suite and map editor to boot. Make no mistake, this is DOOM 2.0 and it¡¦s one of the very best shooters you can buy on PS4 right now."
2016,Doom,"After so many years, we finally have a new DOOM and it truly feels like a classic game with it's frenetic and addictive gameplay combat. Prepare to fight thousands of demons in planet Mars and hell like the old times. Fantastic accomplishment for id Sofwtare and Bethesda once again."
2016,Doom,It may not be genre-defining like its progenitor but it¡¦s easily the best shooter on the current crop of consoles and one of the finest first person shooters of recent years.
2016,Doom,"id Software teaches us a lesson on how to make a great FPS campaign looking at the roots of the genre but making it new and fresh with spectacular graphics at 1080p and 60fps and the new executions system. The multiplayer is bad, as you should probably have imagined, but Snapmap, the level editor, is absolutely great and will be providing great moments for months to come."
2016,Doom,"With Doom, id has delivered a highly polished, utterly shameless Hellbound hecatomb that confidently swaggers into the world with gaudy fervor. It¡¦s huge, it¡¦s preposterous, and it¡¦s absolutely bloody majestic."
2016,Doom,"DOOM is unrepentantly old school. It¡¦s gore porn to the max, a ballet of bullets and blood that I can¡¦t get enough of. Satisfyingly brutal, solid and most importantly, fun."
2016,Doom,"id Software has taken its original, no-BS Doom formula and very successfully repackaged it for the modern era. The result is a thrash metal loud, gloriously gory, blisteringly fast, and thoroughly entertaining oldschool shooter. Both the single-player and multiplayer modes are basically throwbacks to simpler times, but are wrapped up with contemporary trimmings to create a package that fans of the original Doom games should really enjoy."
2016,Doom,"If you like first person shooters, if you¡¦re an old DOOM fan, or if you just like killing demons, treat yourself to DOOM 2016."
2016,Doom,"Old school gaming strikes back again, and its hits are as powerful as they once were."
2016,Doom,"Doom reminded me that games used to just be fun. It¡¦s an polished and incredibly enjoyable game that blends old-school sensibilities with new-school quality. I appreciate a steak, but every now and again, all I want is a delicious, greasy burger. Doom is that burger."
2016,Doom,"The campaign steals the show, performing at a level the other modes can't match. The straightforward competitive multiplayer recalls the glory days of arena shooters like Quake or Unreal, largely relying on the rush of circle strafing duels to keep players engaged. The standard fare of mode varieties and cosmetics-driven progression check off the boxes of a fully featured experience, but unlike the campaign, it feels generic."
2016,Doom,"Exaggerated, violent, ruthless. Bethesda and id Software took the essence of the shooters you played in the 90s and rewrote it with a modern language. DOOM is an unstoppable FPS, with a bloodthirsty single player campaign and a solid Multiplayer, unfortunately showing some balancing problems."
2016,Doom,"I honestly think we're looking at a spring blockbuster and a truly worthy reboot of a timeless classic. DOOM isn't for everyone. The blinding speed of play, demonic symbolism, demanding controls, and hyper-violence may discourage some from jumping in. If you can handle it, though, it really is a thrill ride."
2016,Doom,"DOOM is an awesome return to form, not just for the franchise but also for the old school shooter genre. A triumph, held back only by lengthy loading times and a slight lack of depth in the single-player campaign. Not that these nitpicks matter when you're shooting demons left and right with a big grin on your face."
2016,Doom,"The multiplayer aside, the true appeal to the game remains in the single-player campaign, which is how it was and should be with a DOOM title."
2016,Doom,"Doom struggles somewhat to finish what it starts, and for a franchise that practically created what we understand as shooter multiplayer 22 years ago, its largely flavorless multiplayer is surprising. But on the whole, as a new interpretation of one of gaming's most formative, difficult to pin down cyphers, id has done a pretty great job in making something that feels familiar and fresh, and, most importantly, pretty damned fun."
2016,Doom,"Doom is a '90s game made in 2016. It's campaign is, plain and simple, lots of fun, as long as you can keep up with its innumerable battle arenas and its gameplay mechanics, based on movement, pure speed and rhythm. Its multiplayer options lack work and don't depend as much on player skills, although the SnapMap mode leverages it, thanks to its almost infinite edition and creation options. This amounts to an all-around game, especially made for players that grew up with FPS games a long time ago."
2016,Doom,It¡¦s a game with confidence in the worth of revisiting its history and an earnest belief that doing so can result in much more than an empty exercise in nostalgia.
2016,Doom,"With Doom, it¡¦s clear that id Software set out to make a shooter game which puts fun above all else, and in that regard, the studio hit the nail right on the head. Some old-school purists may scoff at a Doom game with progression and unlocks and other modern shooter elements, but if their refusal to let go of the past keeps them from playing Doom, they¡¦ll only be robbing themselves of the chance to play what is hands down one of the most solid shooter experiences of 2016 so far."
2016,Doom,"Doom is the perfect mix of the classic and the modern shooters. Fun, frenetic and wild, Doom delivers pure, old school action."
2016,Doom,Doom honors its legacy while setting the stage for a new era for the long dormant franchise. Intimately gory encounters and a surprising emphasis on story more than make up for the bland multiplayer.
2016,Doom,"Look past the lop-sided multiplayer, and Doom is still one helluva reboot. It¡¦s a must for any modern FPS fan looking to taste the ultra-violence of yesteryear. Your Nana will hate it. [August 2016, p71]"
2016,Doom,"Excellent return to the classics cannot deny its modernity at the same time. It attracts with brutality, entertains with endless action and surprises with very clever design. [Issue#264]"
2016,Doom,Doom is a fantastic single-player experience bundled with a weak multiplayer component.
2016,Doom,"By sticking to its core identity and cranking the intensity up, id has raised the bar on how I want action-oriented first-person shooters to feel, and it¡¦s going to be hard to go back to something with less adrenaline after my time with this heavy metal beast."
2016,Doom,"Doom is not the best shooter ever made, but boy did we enjoy it. Many references to the original, plus a lot of chaotic battle on locations that are simply insane. Doom is Doom, but in a modern way, and we thank id Software for that."
2016,Doom,"Kudos to id and Bethesda for managing to make an old game feel new again. That¡¦s not easy to do, and while its multiplayer stumbles, Doom will leave you exhausted from its intensity, sick from its brutality, and yearning for more when you complete its 13-hour campaign. If you like your shooters fast and deadly, Hell is pretty heavenly."
2016,Doom,"Many shooters chase the thrill Doom delivers, but few are as potent in their execution. It captures the essence of what made the classic Doom games touchstones of their day, and translates it to suit modern palates with impressively rendered hellscapes and a steady influx of tantalizing upgrades. Doom is the product of a tradition as old as shooters, and while it's not the model to follow in every case, modern shooters could learn a thing or two from Doom's honed and unadulterated identity."
2016,Doom,"Combat may become a little tedious after long stretches of play, the load times are a little lengthy, multiplayer is a smudge unbalanced, and SnapMap is a so-so addition, but the adrenaline-fueled gameplay and the ample replayability featured within the campaign makes this a standout entry in the FPS genre ¡V let alone a worthwhile resurrection of DOOM."
2016,Doom,"Id Software proved that you can use a classic road to get to present time, without destroying the charm of the original. Doom remains an old-school, dynamic shooter devoid of lengthy cut-scenes and convoluted plot. It's a hell of a ride, just like twenty years ago."
2016,Doom,"What a pleasure it is not to have to reload weapons, or to glide over health and armor pickups without pausing to press buttons, or to whip through levels so straightforward they¡¦re basically slides from one bloodbath to the next."
2016,Doom,"Despite its shortcomings in the multiplayer ¡X easily forgotten and waved off as an unnecessary add-on ¡X and the rare instances of a mechanically loose screw, DOOM is undeniably one of the best looking and sounding shooters there has been for some time."
2016,Doom,"Violent, fast and visceral, Doom finally returns to its origins. The atmosphere and gameplay undoubtedly remind us of how powerful the saga was in the 90's."
2016,Doom,"Relax ¡V this is very nearly the Doom you've always wanted but never really thought you'd get. By focusing on DOOM's brutal, ultraviolent heart iD has created an all-action FPS in the old-school style, but with next-gen looks and a handful of mod-cons. It's not going to reinvent the genre, but it might help you rediscover all the good stuff that used to make it tick."
2016,Doom,"After nearly 12 years Doom is back, and what a comeback. The action is both intensive and smooth, the combat mechanic is surprisingly deep and the graphics are fantastic. On the negative side the design starts to feel a bit repetitive towards the end, and the online mode isn¡¦t as balanced as the best games in the genre. But overall, Doom is just pure fun."
2016,Doom,"Superbly fun. While there are nods to the previous games in the series, there are times where it does not ¡§feel¡¨ like a Doom game. That does not deter from the overall experience. The game is gorgeous, sounds great, and offers reasons to come back and play. The SnapMap mode is an excellent touch, however the multiplayer feels added for the sake of having multiplayer. Doom is known for its single player experience, and that is where it excels the most."
2016,Doom,Doom is saved by its frenetic gameplay represented in the campaign and its Snapmap editor that allows you to do everything. The game would have been better without a multiplayer that deducts.
2016,Doom,"It's very hard not to like the new Doom. The game's approach to shooting is fast, frantic and incredibly well-made, with a feeling of both old and new all at once. The story is relatively long, growing steadily more repetitive the more you play, but multiplayer and SnapMap work nicely as diversions, making the overall package very likeable."
2016,Doom,"Defying the odds, id Software has made DOOM not only a relevant series in 2016, but a great one. They¡¦ve also managed to create three distinct modes that all have their own appeal and feel to them. It¡¦s an amazing package, and one that I¡¦ll continue to come back to."
2016,Doom,"The slogan 'Fight like Hell' says it all. Doom is brutal, it is quick and it is exactly what Doom was in the 90s. That is a big plus, but also a weakness as id Software simply can't manage to modernize the series. The story is insane, the tempo is odd and shooting gets a bit repetitive."
2016,Doom,"Doom in 2016 may not be quite what I had anticipated, but it has just enough old and new to make me a fan."
2016,Doom,"If you like a more-than-decent shooter and lots of blood splatters on your television screen, DOOM remains a force to be reckoned with. I just wish the game was a little more fun to play."
2016,Doom,"As graceful a marriage of old school action and modern sensibilities as you could probably hope for, despite the so-so multiplayer and repetitive setting."
2016,Doom,"Doom feels stuck out of time, a gorgeous, gruesome beauty, but only inches removed from shooter conventions 15 years past their prime."
2016,Doom,"People will be talking about the first two Doom games for decades more ¡V those two games may well be remembered as true classics of the gaming medium a century down the track. This Doom won¡¦t. This new Doom is terrible...Like the greedy organisation that unleashes hell on Mars, this is the product of exploitation; the developers at ID Software and Bethesda are playing with fire in treating a property as valuable as Doom this way."
2016,INSIDE,"By entering the world of Inside, you'll forget your own world and everything that's been going on in it. From beautiful art design to engaging gameplay, thrilling atmosphere to marvelous story, everything about this game is truly exceptional. Do not miss it."
2016,INSIDE,"It's all an experience worth savoring and enjoying throughout the brief five-hour playtime. Much like Limbo before it, Inside is a simple game, utilizing classic tried-and-true mechanics to quietly tell a strong story."
2016,INSIDE,"Playdead's Inside is one of those rare games that has to be experienced first hand in order to understand its importance. Rest assured, you'd be hard pressed to find another game that's equally brilliant and beautiful."
2016,INSIDE,"Inside is a game that has to be experienced first-hand to be understood and I¡¦d urge everyone to play it. At three to four hours it is on the short side, but thanks to the thought provoking and surprising story, tight gameplay and exceptional sound and visual design, Inside will leave a long lasting impression that will more than make it worth its price tag."
2016,INSIDE,Not only would I recommend playing this game I would put it under the category of required playing especially as it is very competitively priced for a game that has obviously had a huge amount of work put it to perfecting it.
2016,INSIDE,"Inside is a masterpiece waiting to be played and a worthy successor to Limbo that is just as thought-provoking, if not more. Playing through even one section of the game, the amount of polish and attention to detail is apparent. Not many games stick with me after the credits roll, but Inside is one of those rare few."
2016,INSIDE,"The game is a procession of stately, grim exclamation marks. It is visionary art."
2016,INSIDE,"Inside is constantly surprising, introducing new elements without ever overwhelming, maintaining an excellent pace over the course of about four hours."
2016,INSIDE,"When a game has a perfect level design, an almost perfect character design and a fantastic narrative with an amazing atmosphere it results in one of the most fascinating games I've played in recent years. And that game is called Inside."
2016,INSIDE,"It took Playdead almost six years to put out their follow-up to Limbo, and that time certainly was put to good use. It¡¦s world is simultaneously macabre and filled with heart."
2016,INSIDE,"Much like Limbo, Inside also has a timeless quality to it and is yet another must-play experience from Playdead."
2016,INSIDE,It¡¦s a rare game that keeps you ruminating over the meaning of its background elements long after you¡¦ve finished playing it. It¡¦s also a rare game that demonstrates exactly what the medium as a whole is capable of. Do not wait: play it...Inside is absolutely astonishing.
2016,INSIDE,"Playdead could have simply made yet another 'Limbo' and it would've been great. Instead, they kept the core gameplay and went into a bold yet familiar direction with it. 'Inside' hasn't left my thoughts since I completed it, and I doubt it will any time soon. It's a fantastic game that proves what the medium can do when used correctly, and provides an experience that can't be replicated by film or literature."
2016,INSIDE,"Describing Inside is difficult, not because one can¡¦t find the words, but because it has to be seen to truly be believed."
2016,INSIDE,"It's rare that a game can be beautiful, gruesome, tense and exhilarating all at the same time, but Inside does just that. Its six years in the making really show. It might be just a sidescroller on paper, but it's so polished and well-put-together that its a showcase of Playdead's mastery. It's captivating and moving, gory and bleak but ultimately, Inside is a piece of art from the first stumbling steps to the closing credits."
2016,INSIDE,"Playdead's Inside is fiercely intelligent, exquisitely grotesque - and one of the best video games of the year."
2016,INSIDE,"The masterful art direction, polished and responsive physics, and blisteringly intuitive gameplay design elevated Inside far, far beyond my expectations ¡V which were already pretty high. Inside is a masterpiece."
2016,INSIDE,"Gameplay wise, the game is constantly changing and surprising you with fresh ideas...An exceptional game."
2016,INSIDE,Inside delights from start to finish. Don't miss out on what will surely be one of the best games of this generation.
2016,INSIDE,The prospect of not playing this game is far scarier than whatever Inside's ominous bad guys have planned for that poor little boy.
2016,INSIDE,Brings to fruition whatever Playdead¡¦s designers were scratching at six years ago...This now feels like where Limbo was headed all along. I¡¦m just grateful Playdead has been afforded the chance to bring us there.
2016,INSIDE,"Inside is one of those games that can mark you for life. Walking in the footsteps of Limbo, it builds its own identity in a beautiful way and improve the formula in absolutely everything we had already fell in love with just a few years ago."
2016,INSIDE,"Combine a highly compelling visual narrative with superb puzzles and brilliant platforming, and you have Inside, one of the most intriguing, addictive, and beautiful-looking games of this generation. Its only downside is that it's quite short, but while it lasts, it's absolutely glorious."
2016,INSIDE,"Inside expands on the concepts and scope of its predecessor in wildly creative ways, and it's so immaculately designed and constructed from top to bottom that it almost feels suitable for display in an art museum. This is one hell of a followup."
2016,INSIDE,"Inside very clearly builds upon what made Limbo great, and in fact builds something greater. Its unimaginable twist may leave you dumbfounded, confused, and quite possibly speechless, but it will fuel heated discussion with your friends about its meaning, its message, and its intentions."
2016,INSIDE,"A masterpiece. The new game from Limbo's creators is an experience that everyone should try. Epic story, beautiful art work, perfect level design and terrific gameplay mechanics are just some elements that makes this game a contender for Game of the Year."
2016,INSIDE,"My chest tightens as I recall the feeling of entering new areas, succumbing to surprise deaths and witnessing its many unexpected moments. By the end, I felt as though I had lived through someone¡¦s horrible dream, and I couldn¡¦t wait to do it all over again."
2016,INSIDE,Playdead did it again and created a masterpiece which manages to surpass the masterpiece of Limbo in every possible way. We don¡¦t believe a higher praise could be said for their second game.
2016,INSIDE,Inside is an incredibly and thought provoking experience from start to finish and a game that I won't soon forget.
2016,INSIDE,Quotation forthcoming.
2016,INSIDE,"Inside is a game that simply has to be experienced. Its mystery filled dystopian world is brought to life expertly through tight, thoughtful design, masterful art direction and sublime sound design. Inside isn¡¦t like many other games, because not many others can do so perfectly what it does regularly."
2016,INSIDE,"Inside is a perfect videogame. Is impeccable in terms of narration, gameplay, game design and style. Is a thrilling and painful adventure, an unforgettable experience you cannot miss."
2016,INSIDE,"Haunting, bizarre, atmosphericÿ Brilliant. Playdead¡¦s new game is better than Limbo, and achieves an amazing and terrifying vision of a dark and disturbing world."
2016,INSIDE,"Inside achieves something that Limbo didn't: It actually lives up to its opening moments, delivering astounding setpieces and an unforgettable final sequence. Those jaw-dropping last moments are a fitting endcap to this superbly crafted, beautiful game."
2016,INSIDE,"Inside stands on its own merits as a superbly captivating and moving experience, one that's bound to be on your mind in the time you spend away from it."
2016,INSIDE,"Inside is a brilliantly crafted game that will keep you talking about it long after you¡¦ve finished playing. Its moody, atmospheric world and terrific puzzle-platforming are simply the hooks to first draw you in."
2016,INSIDE,"Playdead took everything they did well with Limbo and brought it to the next level, carefully crafting an incredibly meditative, unpredictable and mature adventure. With a flawless, clean and detailed artistic design and an incredible variety in gameplay, Inside is a real masterpiece that will repeatedly blow your mind. A must buy."
2016,INSIDE,"Original, thoughtful, aesthetically pleasing and dark, Inside offers cool puzzles, a deep and meaningful context and a unique experience that every gamer should play. The only imperfection is a premature ending that stops Inside from developing all of its potential."
2016,INSIDE,"The most haunting and affecting game of the year. [Sept 2016, p.76]"
2016,INSIDE,"Inside's quiet confidence is a maneuver invented to not only disarm the player, but also destabilize assumptions that seem inseparable from an entire class of games. Plenty of games have pulled the curtain away to thunderous applause. Only Inside has room for shock, panic, and the inconceivable notion that the nightmare isn't yet over."
