Year,Game,Review
2016,INSIDE,"Playdead's Inside is a strange, freaky and compelling game. With stunning visuals and a graceful control scheme, it's a perfect, small, indie game."
2016,INSIDE,"Basically, what I'm trying to say is that Inside excels in pretty much every way imaginable."
2016,INSIDE,"Inside shows that Playdead has a knack for the short but powerful puzzle-platformer. The puzzles are logical and challenging, while the story is told well without a reliance on the usual things like dialogue and cut scenes. The balance between both creates a game that has a ton of memorable moments, and the flow is smooth enough that you're compelled to keep playing until you reach the thought-provoking ending. With a presentation that adds greatly to the narrative, Inside is well worth your time."
2016,INSIDE,"Inside may require thought, care and occasionally a sharp sense of timing to progress, but its obstacles never feel unfair. [Issue#296, p.120]"
2016,INSIDE,"Dark, sombre and thoughtful, Inside is a brief experience that's satisfying in the questions it creates."
2016,INSIDE,"We expected a brief, morbid adventure, but we never expected it to surpass Limbo. [Sept 2016, p.80]"
2016,INSIDE,"Inside is a rarity, both in terms of its ambitions and its construction."
2016,INSIDE,"Inside is a short but amazing trip through a broken world. It offers not only entertaining and logical puzzles, but also a story that is as tragic as it is bizarre. The fluent animations are the cherries on top of this tasty platform cake."
2016,INSIDE,"Inside is an incredible game, a compelling artistic achievement that deserves your time no matter what genre of game you normally prefer. I [wish] there was a tiny bit more to it, but between the gameplay, the animation and the atmosphere, it¡¦s enough to be a worthwhile experience, and one you won¡¦t forget for a good long time to come."
2016,INSIDE,"Inside is not for those looking for hours of fun, opting instead to channel the ¡¥games as art¡¦ mentality that has been debated into the dirt. It¡¦s a game that people will be trying to figure out the meaning to for months to come."
2016,INSIDE,"As phenomenal of an experience as Limbo was, Playdead somehow managed to top it with Inside. It¡¦s a hauntingly beautiful game, especially for how violent and dark it turns by the end. The mechanics, while simple, really cause you to stop and think how all the elements of a puzzle should work together. Although it¡¦s a rather short experience, Inside will undoubtedly keep you thinking hours after you¡¦ve seen the credits roll. You¡¦ll definitely be pondering the implications of what happened, and it¡¦ll make you eager to replay it in case you might have missed anything."
2016,INSIDE,"As a piece of commerce, it is incredibly brief and depending on how you value one over the other, when you decide to experience this masterpiece is up to you. However, make no mistake, Inside is a game I recommend that everyone play."
2016,INSIDE,"Inside is an incredible sophomore swing from Playdead, as the atmosphere, aesthetic and gameplay meld into one glorious experience that demands attention. Don¡¦t read about it, don¡¦t seek more, don¡¦t ask questions ¡X just clear your afternoon schedule and experience it."
2016,INSIDE,"Inside is an artistic triumph. Video games, at their best, fold their various components into a whole that is far greater than the sum of their parts. Inside does exactly that, and more so does exactly what its name implies: it gets in your head, in your system, and stays there."
2016,INSIDE,"After LIMBO, INSIDE is another masterpiece from Playdead. Maybe not that innovative with its gameplay, this new game is above all a great performance when it comes to setting an atmosphere and telling a story without saying a word. And, yes, it's beautiful."
2016,INSIDE,"It is definitely one of the most intense gaming experiences I was lucky enough to play in the last few years. With simplicity and atmosphere at its core, it took me on an emotional journey with an intensity and ruthlessness I didn¡¦t expect."
2016,INSIDE,"Inside builds on every strength of Playdead¡¦s Limbo, while also delivering a compelling yet haunting world filled with smart puzzles and inventive mechanics."
2016,INSIDE,A minimalistic yet excellent puzzle-platformer that achieves everything that it attempts almost perfectly. Only its slower pace and the lack of a real challenge could be improved.
2016,INSIDE,"Masterpiece? Whatever you call it, it's a game that will blow your mind. And that's totally worth the ride."
2016,INSIDE,"I can imagine some players being disappointed that Inside is perhaps a bit too much like Limbo. From both games¡¦ dark themes and imagery to the sorts of puzzles they offer up, there are plenty of lines to be drawn between them."
2016,INSIDE,It's an astonishing conclusion as haunting and evocative as anything you'll see in a game this year.
2016,INSIDE,"INSIDE is a top quality product that will let you enjoy a great journey, as amazing as overwhelming, where the excellent visual language drawn by Playdead is the key feature making the story absolutely special. INSIDE is the umpteenth piece of proof that an actually ""different"" game can be crafted with simple and functional ideas, with neither cut-scenes misuse nor fancy narrative techniques. Even the poor longevity get overshadowed: INSIDE offers an experience that only asks to be lived, not for the quantity but for the high quality of its content."
2016,INSIDE,Inside takes an already great formula of and improves on it in just about every way. The beautifully designed environments coupled with the cleverly crafted puzzles easily makes this the indie game to beat this year.
2016,INSIDE,"Inside is not only one of the best indie games in a long time, it might as well be the best game of 2016, so far. With beautiful design and an interesting story, Playdead manages to deliver a platform adventure that won't leave anyone untouched."
2016,INSIDE,"Whether or not it achieves the same touchstone status as Limbo, Inside is a spellbinding, haunting experience - one I don't intend to relive any time soon, but absolutely recommend."
2016,INSIDE,"Inside isn¡¦t just some incremental improvement over the basic premise of Limbo, it¡¦s one of the best puzzle-platformers ever made. From its brilliant puzzle design, which finds a way to balance constant progress and momentum with puzzles that require deep thought, to its gorgeous lighting effects, this is the type of game that demonstrates why the indie development scene is something special."
2016,INSIDE,Inside is one of the best games of this year so far. The puzzles are fantastic and overall it's a very addictive game.
2016,INSIDE,"Although not the breakthrough that was Limboback in 2010, Inside is nonetheless a beautifully-crafted refinement of that experience."
2016,INSIDE,Playdead¡¦s greatest feat in creating Inside was making it look like they never created it in the first place.
2016,INSIDE,"Inside is a enormously atmospheric platformer with puzzles, with a great graphical style, and it's thrilling until the end."
2016,INSIDE,"If you even remotely enjoyed Limbo, you'll feel right at home with Inside."
2016,INSIDE,"Ultimately, if you enjoy dark games with a healthy dose of problem-solving and/or you enjoyed Limbo, then you¡¦ll definitely enjoy Inside as well!"
2016,INSIDE,Inside is the perfect evolution of Limbo. An unforgettable journey worth your time.
2016,INSIDE,"Its vividly depressing, yet wondrous world proves that Playdead is still the master of atmospheric side-scrolling platformers, and it quickly became one of the best games I¡¦ve played this year."
2016,INSIDE,"Inside recounts the journey of a young boy in a dark, mysterious and aesthetically significant gaming world. It¡¦s an excellent puzzle platformer, able to convey emotions like fear and doubt, and it stimulates the player¡¦s observation."
2016,INSIDE,"Set an evening aside where you immerse yourself in this living painting, and enjoy every single detail."
2016,INSIDE,"While it doesn't stray far from the template Limbo set, Inside is a gorgeous, beautifully directed puzzle platformer that you'll want to see through to the end."
2016,INSIDE,"Fun, easy, creepy, scary, bizarre, and oozing with atmosphere, but doesn¡¦t quite stick the landing."
2016,INSIDE,"Inside is short but immensely interesting, telling its story almost like a silent movie, without words. Playday has once again managed to create something unique, a game that stays with us for hours after finishing the story."
2016,INSIDE,"Inside is an easy recommendation if you loved Limbo, but the abrupt ending is a bit of a bummer."
2016,INSIDE,"Visually though this is one of the most impressive games of the year, with the subtle animation and sparing use of colour telling you all you need to know about the situation without a word of dialogue. Inside isn¡¦t a fun video game, but it is a clever and intelligent one. And despite how long it¡¦s been since Limbo it¡¦s telling that nobody has managed to perfect that formula as well as Playdead."
2016,INSIDE,"Playdead has greatly improved how it delivers a story, but hasn¡¦t moved away from ambiguity. The latter three-quarters of Inside cheapens the otherwise refined package, only saved because the studio is the undisputed master of horrific puzzles. Ending aside, it¡¦s definitely worth a look."
2016,INSIDE,"Compared to Limbo, Inside does not propose any innovations and does not evolve the gameplay in any way. The new Playdead game, however, is a fascinating adventure to play, with bated breath, from start to finish thanks to the wonderful setting full of mystery."
2016,INSIDE,"This is a beautiful, haunting, and memorable game, a worthy follow-up to Limbo. Its puzzles, although rarely difficult, are engaging complements to the story. The real achievement of this game, though, is the way that it crafts its narrative: detailed environments convey the bizarre world that you travel through; introspective moments are filled with minimalist sound design and just the barest touches of music; and the things you must do to complete your journey force you to confront the realities of humanity, freedom, and existence."
2016,INSIDE,"A great game from start to finish. Fans of indie titles, moody atmosphere, and/or puzzle platformers should grab Inside ASAP."
2016,INSIDE,"At some point you get the feeling Playdead maybe didn¡¦t know how to solve their own mystery and the game wraps up in a messy, unusual and unsatisfying way."
2016,INSIDE,"Inside, from the makers of Limbo, is just like its predecessor - truly amazing to explore. The beautiful atmosphere and the intriguing themes are interesting, even though the game is fairly short and does not succeed in being very challenging."
2016,Titanfall 2,The best way to describe the gameplay in Titanfall 2 is fluid and precise.
2016,Titanfall 2,"While its contemporaries focus on new ways with which to shock and excite on screen, Respawn makes the simple act of playing feel superlative. Its multiplayer is bigger and better, with the necessary depth and momentum to take it beyond these first few months after release, while its short but exciting single-player mode has the craft of some of the best campaigns of the last decade."
2016,Titanfall 2,"It¡¦s a better, and fuller version of the original game to me, and ideally we¡¦ll see developer Respawn get another chance to expand upon the series in the near future."
2016,Titanfall 2,"By adding a truly surprising and impeccably designed single-player campaign that is consistently fun to play, as a package Titanfall 2 is the most pure, minute-to-minute fun I¡¦ve had with any game this year."
2016,Titanfall 2,"Titanfall 2 might not fix every issue you had with the previous game (and depending on your tastes, it might introduce one or two new ones), but it's a bigger, bolder game that takes a few chances and comes out better and more distinctive for it. On top of all that, it simply feels great."
2016,Titanfall 2,"Everything that makes a shooter fun - mobility, action, and a sense of empowerment - has been perfected here, and we're already waiting to see what Respawn does next."
2016,Titanfall 2,"A frenetic, enthralling, and inventive shooter in both single and multiplayer, Titanfall 2 is a spectacular beast of a game that is deserving of a place among the greats of this generation."
2016,Titanfall 2,"Titanfall 2 is everything Titanfall should have been ¡V storified, robust, and sufficiently multiplatform. The real series starts here, and I¡¦m surprised at how nothing at all feels phoned in or tacked-on."
2016,Titanfall 2,"In an era where it feels like the majority of shooters either have single-player or multiplayer tacked on, Titanfall 2 is the full package. The top-tier campaign has nearly perfect pacing, and the subtle revisions and additions to the multiplayer make it better than ever. For first-person shooter fans, Titanfall 2 is a must play."
2016,Titanfall 2,Titanfall stands out as an example of how there is still plenty of room for innovation and newness in a crowded genre space. It's superbly executed and incredibly fun to play.
2016,Titanfall 2,"With a single player campaign that subverts expectations at every corner, a movement system that can only be described as heavenly and a robust selection of multiplayer modes with more free content to come in the future, Titanfall 2 is one of the year¡¦s biggest surprises and is a must-buy for any serious shooter fan."
2016,Titanfall 2,"Titanfall 2 is everything that Titanfall should have been. It contains a wonderfully endearing campaign mode that contains some unique and fun gameplay design, while satisfying the multiplayer experience with a bevy of modes and customization options. This certainly feels like a complete game."
2016,Titanfall 2,"Far from the footnote it could have been, Titanfall 2 is a huge, headline shock. In a standout year for the shooter, this interstellar adventure dares to go big and beyond the familiar. What it finds out on the frontier is worth seeing. [January 2016, p74]"
2016,Titanfall 2,"The core Titanfall moveset is a joy, and it has been thoughtfully expanded with a delightful grappling hook. [Jan 2017, p.112]"
2016,Titanfall 2,"Ace online action combines with a truly rollicking campaign in one of the year's shootiest surprises. [Christmas 2016, p.66]"
2016,Titanfall 2,"Respawn could have settled for big dumb fun, but Titanfall 2's eclectic, standout campaign and honed multiplayer make for a smart and unusual shooter. A total rush from beginning to end. [Christmas 2016, p.84]"
2016,Titanfall 2,"Titanfall 2 succeeds in being both accessible and fun, which is a nice change of pace in the modern era of shooters. It isn't the most complicated of shooters, nor is it the most refined. However, it very well may be the most fun, which is the most important thing to a gamer."
2016,Titanfall 2,"Even if you never touch the multiplayer side of Titanfall 2, the game is worth the price of admission for its creative and continually engaging single player experience. Challenging, puzzling, surprising, funny, and above all, satisfying, the campaign elevates Titanfall 2 to one of the best shooters of the year. Pair that stellar accomplishment with an equally full-featured competitive suite, and the result is the definition of ¡§must buy.¡¨"
2016,Titanfall 2,"Titanfall 2 improves on the original in almost every way, it takes the frantic action and amps it up even more in both the multiplayer and the brilliant new single player mode. Couple this with the consumer friendly DLC approach, excellent visuals and creativity and you have one fine game. Respawn have outdone themselves."
2016,Titanfall 2,What Titanfall 2 boils down to is the kind of experience that you are looking for. I already had somewhat of a salty opinion from what I had seen of the first game although I also had no idea what to expect. I was pleasantly surprised and was blown away within the first hour of playing. Each day I went to work I couldn't wait to come home and play more.
2016,Titanfall 2,"Titanfall 2 rises to the challenge of building something worthwhile on its predecessor¡¦s foundation, and it¡¦s fresh, fun and full of surprises. Happy endings aren¡¦t always common in boy-and-his-¡¦bot stories, but here¡¦s hoping these mechanical marvels will stick around for a good, long time."
2016,Titanfall 2,"Titanfall 2 is better than the first game in almost every aspect. Campaign connects us with the world, and multiplayer is improved thanks to more varied Titans and maps. Respect for Respawn: for listening to the consumers and providing almost a perfect sequel."
2016,Titanfall 2,"Titanfall 2 is what the first-person genre so desperately needed: an injection of originality. The divine single player campaign is something truly special, and we won't be forgetting any of its standout moments in a hurry. Couple this with a deep multiplayer serving that offers a variety of modes and unique gameplay mechanics and you've got one of the best FPS games of the generation so far."
2016,Titanfall 2,"Titanfall 2 is easily some of the most fun you'll have this year, both online and off."
2016,Titanfall 2,"With its thrilling multiplayer now backed up by a surprisingly excellent single-player campaign, Titanfall 2 is every bit the sequel I'd been hoping for."
2016,Titanfall 2,"It¡¦s not a perfect game by any definition, but what game is? It¡¦s also not a game that will convert random people into first person shooter fans. What you will find in this game is a series of shooting and platforming set pieces that will make you think, ¡§Wow! I just did that? I am awesome, all hail me!¡¨"
2016,Titanfall 2,"Titanfall 2 is a far more ¡§complete¡¨ package then that the first game was, offering one of the best single player campaigns in first person shooter, and a robust and cleverly nuanced multiplayer. It's everything the first game should have been."
2016,Titanfall 2,"Respawn Entertainment managed to take the foundation of the first Titanfall and craft a great campaign along with an improved multiplayer experience, making the sequel a fantastic game that any FPS fan should check out."
2016,Titanfall 2,"It¡¦s rare that a sequel evolves on every part of the original concept so consistently for the better, but Titanfall 2 is that exception. Its feelgood movement is the foundation for both the engaging action and platforming gameplay of its strong campaign and its over-the-top competitive multiplayer. With bolstered progression, customization, variety, and a fleshed-out story, Respawn has made good on its original vision with Titanfall 2. And bottom line, it¡¦s just damn fun to play."
2016,Titanfall 2,"Titanfall 2 is to be respected for accomplishing all its objectives. Quantity in games is nice, but Titanfall 2 proves that quality is often preferable."
2016,Titanfall 2,"One of the best first person shooters of the generation, with significant improvements in depth and longevity ¡V and even a half decent story mode."
2016,Titanfall 2,"TITANFALL 2 improves most of the original game with great single player campaign, new titans, weapons and perks for it's frantic multiplayer that adds some interesting new modes. Fluid, speedy shooter (little less than first game) and more balanced experience."
2016,Titanfall 2,Titanfall 2 improves every multiplayer aspect of its previous installment and features a short but intense single player campaign. This game is a revolution in the first person shooter genre.
2016,Titanfall 2,"Titanfall 2 is undoubtedly a shining example of brilliant game design. The campaign is short, but it's also perfectly paced and full of surprising moments, while the multiplayer changes make the experience way more varied when you compare it to the predecessor."
2016,Titanfall 2,"This isn't just a worthy sequel to Titanfall, but one that improves upon the original while adding a superb single-player campaign. The latter combines fast-paced action, pilot acrobatics, heavyweight Titan warfare and a surprising amount of heart in one of the most enjoyable solo storylines of the year...It's a masterful piece of work."
2016,Titanfall 2,"On the one hand, you have a short, but fun single player that¡¦s more free and open than most FPS campaign, and on the other, a multiplayer that¡¦s an iterative improvement on an already fantastic game. In other words, Titanfall 2 is as exhilarating and refreshing now as the original was back in 2014."
2016,Titanfall 2,Titanfall 2 breathes new life into the concept and has solidified it as a franchise.
2016,Titanfall 2,"Intelligent, creative, and never less than thrilling, Titanfall 2 finally realises the series' true potential with verve and polish."
2016,Titanfall 2,"Titanfall 2 demonstrates a vitality that its predecessor couldn't. Whereas the first Titanfall kept up its breakneck pace throughout the entirety of every match, Titanfall 2 understands that sometimes, dialing things back for a few moments can make the long run much more enjoyable. In many ways, Titanfall 2 feels like the game Respawn should have made in 2013. It's a fantastic sequel. It's a fluid shooter. It's a spectacular game."
2016,Titanfall 2,"Titanfall 2 is the new king of the FPS hill. Controls are tight, action is fierce, maps are intricately designed, and Titans are badass. The cherry on top is a campaign that is genuinely enjoyable, and one that fans of the first game are likely to be satisfied with, which expands upon the universe of the series. Group all of this together with an ambitious free DLC plan, and the choice of which shooter to buy this holiday season becomes obvious. Titanfall 2 is second to none."
2016,Titanfall 2,Respawn Entertainment did just that with Titanfall 2; they turned the ideas and mechanics from the first game into an even better experience.
2016,Titanfall 2,"Titanfall 2 takes the first spot in the frantic, close-quarter scenario shooters. Respawn Entertainment has put a lot of effort in this game, clearly aiming to take the spot of the Call of Duty franchise, whose last entry will be on stores in a few days. An amazing campaign and an entertaining multiplayer."
2016,Titanfall 2,"Titanfall 2 is an excellent shooter from many points of view. It offers a good amount of contents and a solid multiplayer. It is a direct evolution of what we saw in the first chapter, but with several improvements to make it even more attractive."
2016,Titanfall 2,"Titanfall 2 is both a triumph and a mild disappointment, providing an exceptionally well-crafted singleplayer campaign alongside robust multiplayer that doesn¡¦t quite hit the heights of its groundbreaking predecessor despite some great additions to the formula ¡V the Legion Titan¡¦s minigun is undoubtedly a thing of wonder. Despite my feeling that the multi has lost a few tricks, it remains pretty much best-in-class, and newcomers to the series will undoubtedly be blown away."
2016,Titanfall 2,"The story lacks depth, but the connection between the player and his Titan is worth the journey. The multiplayer, however, is almost worth the price tag on its own."
2016,Titanfall 2,Titanfall 2 is the product of a developer that took to heart all the criticism that was thrown at the original.
2016,Titanfall 2,"There isn¡¦t a shooter on the market that can compare with Titanfall 2 when it comes to imagination, inventiveness, and flat out spectacle."
2016,Titanfall 2,"All in all, Titanfall 2 is a well-made and enjoyable shooter that should be a good buy for any shooter fans. The main campaign is fun to play through, and it makes good use of gameplay mechanics. The multiplayer is fast, frantic and exciting, and it has enough variety that people will repeatedly come back to blast apart pilots and Titans. For PlayStation owners, this is the first chance to try out Titanfall's high-mobility gameplay, but even fans coming over from the Xbox One should enjoy the improvements."
2016,Titanfall 2,"Titanfall 2 is likely pretty close to the game the original Titanfall would have been if we lived in a perfect world where deadlines did not exist and developers didn¡¦t need to put a product on shelves in a timely fashion in order to stay in business and feed their families. It¡¦s a complete package, it¡¦s polished and pretty, and it¡¦s super fun."
2016,Titanfall 2,"With Titanfall 2, Respawn is offering a fresh and new FPS, with a solid Campaign mode. Multiplayer is still very good but with some gameplay simplifications is not the total evolution we expected."
2016,Titanfall 2,"Titanfall 2 improves the breed mainly by adding a true solo campaign mode which was really lacking in the first game. The multiplayer doesn't evolve much, but overall the game offers strong content for gamers."
2016,Titanfall 2,"First two hours of campaign are surprisingly boring, since beautiful Typhon nature quickly gets replaced with dull industrial zones. But when it looks like Respawn has once again screwed up singleplayer, Titanfall 2 suddenly picks up the pace and starts delivering one interesting setpiece after another. [Issue#214, p.48]"
2016,Titanfall 2,"Titanfall 2 is designed just well enough, and with enough layers so to not be entirely derivative. Hero simulations are so vastly abundant in this industry - so if you¡¦re going to play one, you might as well choose from those who do it the best."
2016,Titanfall 2,The surprisingly good -albeit short- campaign along with a well balanced multiplayer mode offers a great game that should not be lost from your radar during this ¡§FPS packed¡¨ season of the year.
2016,Titanfall 2,"There's a few games that compete with Titanfall 2 as a vehicle for multiplayer chaos, but there's nothing out there like its single-player campaign."
