"score","review"
4,"The controls are really, really borked in the PC version. Felt like something that existed 15 years ago.All hints and tips in the tutorial are for controller players, so unless you use that, you are screwed, or you just have to man up and randomly mash buttons to see what goes where in the mapping... Not very helpful to know that ""B"" or ""LS""-button does something on the controller ifThe controls are really, really borked in the PC version. Felt like something that existed 15 years ago.All hints and tips in the tutorial are for controller players, so unless you use that, you are screwed, or you just have to man up and randomly mash buttons to see what goes where in the mapping... Not very helpful to know that ""B"" or ""LS""-button does something on the controller if you are using mouse & keyboard.tl;dr:If you use keyboard + mouse combo, don't even bother.Graphics and general feel is so-so.…"
0,"Game is fine, no word for it. But PC release ? Absolutely garbage. ""Stop Working"" problems , HDMI - DVI problems , multi monitor problems , standart scaling problems ... etc.They say ""this time Pc version will be good version for this game"" ... They did not keep promises.On steam community page , people want a refund ... pathetic !"
1,"Wow... Just wow... And not in a good way.Let me just say this: the game is a very bad port from console (Xbox) to PC. Especially the controls and thus the gameplay have suffered, and since that is the bread and butter of any game it just breaks Dark Souls II. It's clunky, it's non-responsive, it's broken.That really should be all you need to know not to buy the game at this point."
3,"Sell me a Finished product.Why do I keep wasting money on ""just released"" games for PC??? Do NOT buy this for PC. Great graphics, but crashed on opening intro and then the first time I tried moving. The PC interface was super annoying. If you assume that it wouldn't be that hard to make the interface PC friendly, you would be wrong. Yuck.As a first time player of Dark Souls - I hadSell me a Finished product.Why do I keep wasting money on ""just released"" games for PC??? Do NOT buy this for PC. Great graphics, but crashed on opening intro and then the first time I tried moving. The PC interface was super annoying. If you assume that it wouldn't be that hard to make the interface PC friendly, you would be wrong. Yuck.As a first time player of Dark Souls - I had no idea what anything represented. Tutorial maybe? I want my $60 back.…"
10,"I played demon souls and dark souls and acquired the end game achievements, Now I'm playing the Dark Souls 2 in 4 hours straight, it is more challenging than the other and more easy navigation. This game is deserve to have a score of 10. This is an amazing and challenging game that I've ever played."
3,"Re-review: Dark Souls 2 is by far the best in terms of content and PvP but where it suffers (at the cost of the soul of the entire series) is in the enemies. Basically they are the same and to compensate for this the devs have added more of them, twisting the original Souls formula from 'fair because you learn' to 'overwhelming until you break through the wall or run away'.Dark Souls 2Re-review: Dark Souls 2 is by far the best in terms of content and PvP but where it suffers (at the cost of the soul of the entire series) is in the enemies. Basically they are the same and to compensate for this the devs have added more of them, twisting the original Souls formula from 'fair because you learn' to 'overwhelming until you break through the wall or run away'.Dark Souls 2 is not a worthy sequel to the series and the hardship is not worth the time.=========HOW I RATE: 10-9 score: perfect or near-perfect don't exist; 8 score: one of the best games ever. Top score; 7-6 score: great but not one of the best; 5-below score: serious flaws.…"
1,"Unplayable with mouse and keyboard. They didn't even take the time to translate all keymapping hints to a keyboard input. And on top of that, when you press a button it litteraly takes ages for your character to actually do something.Graphics are very bad aswell, yet i wouldn't mind if you could actaully play the game. Getting infos in this game is also a pain in the ass."
3,"FREAKING AWFUL very overrated game especially for  PC do not listen to pro-reviewers that give a 9.0 or 10 to this abomination. The graphics are a joke  they are not as bad as the first game but still are bad with a lot of blurry low quality textures and polygon designed animations that even in the highest graphic settings remind me some old games from 2002 as for the gameplay feelsFREAKING AWFUL very overrated game especially for  PC do not listen to pro-reviewers that give a 9.0 or 10 to this abomination. The graphics are a joke  they are not as bad as the first game but still are bad with a lot of blurry low quality textures and polygon designed animations that even in the highest graphic settings remind me some old games from 2002 as for the gameplay feels lacking and amateur programming work, it is almost unplayable and annoying if you try to play with a keyboard and a mouse (i am not going to waste my money to buy a gamepad just for one title). It is a very very overrated title and extremely overhyped from stupid  paid game site and from reviewers that have been paid to promote this as the best RPG in the world do not fall into their hype and into their propaganda or you will regret your money. save them  for buying The Witcher 3 or for Dragon Age Inquisition at least or some other future title…"
8,"I'm a Souls veteran, with 3 playthroughs of Demon's Souls and 7 of Dark Souls, and by no means am I disappointed with Dark Souls II.  Maybe a little underwhelmed, but not disappointed.  It's different from both Dark and Demon's, but somehow feels like a strange combination at the same time, which is good (but again, different).  By no means is different bad, in fact I think that's thisI'm a Souls veteran, with 3 playthroughs of Demon's Souls and 7 of Dark Souls, and by no means am I disappointed with Dark Souls II.  Maybe a little underwhelmed, but not disappointed.  It's different from both Dark and Demon's, but somehow feels like a strange combination at the same time, which is good (but again, different).  By no means is different bad, in fact I think that's this games sticking point.  If it was too much like the first, I don't think it would have been as enjoyable for someone like me, who knows the mechanics inside out, upside down and backwards.  I feel like I'm new again, holding up my shield while slowly turning the next corner, and hoping not to come across some new trap.For all the hate it's getting for not being exactly like Dark Souls, I can agree with some of the points.  The weapons degrade at a shocking rate, although I am still early on (3 hours in) so who knows, upgrading may fix that.  And of course, we could discuss the lighting engine and all that fluff, but it's been said and done before.  We know it's not what was shown at E3 in 2013, nor what was in the beta, but whatever.  Although, I still feel that it's trying a bit too hard to give the lighting effects a chance, because nothing actually looks, you know, dark yet... Here's hoping The Gutter proves this point moot.Anyways, first impressions aside, I'm glad I purchased this game, and I plan on playing it for a good long time.  Is it as good as the first, I don't think so (although I'm a admittedly jaded), but it doesn't have to be... it's its own game that stands up just fine with the Souls line.  So I hope to see you all out there, and have some jolly cooperation! Oh, and don't forget, seek larger souls!…"
10,"Things to be said:- The level design could have been better, a la Dark Souls, but still nice;- I'm personally of the opinion that what made Dark Souls level design great was the fact that you could NOT teleport between bonfires until late-game, and this gave value to the excellent design, twists and turns, shortcuts and secrets;- Combat mechanics have been refined to be even moreThings to be said:- The level design could have been better, a la Dark Souls, but still nice;- I'm personally of the opinion that what made Dark Souls level design great was the fact that you could NOT teleport between bonfires until late-game, and this gave value to the excellent design, twists and turns, shortcuts and secrets;- Combat mechanics have been refined to be even more skill-based;A.k.a., true Souls players love and will love it. Scrubs should rate less and Git Gud.…"
10,"Why do people buy a game at launch, especially a PC port, and expect the game to be 100% perfect? Grow a pair, and learn to be patient for the game to be patched, jesus. It's this self entitled attitude of ""I DESERVE THiS GAME NOW"""
10,"First off, lets get some things out of the way that others are complaining about. The multi-player is fine, you're not supposed to be able to play through the entire game with you're friends, and while many whine about this, that's how the game was developed. It's not an issue or a bug they need to fix nor is it ""clunky"", it's how they chose to implement multi-player into the game. Yes,First off, lets get some things out of the way that others are complaining about. The multi-player is fine, you're not supposed to be able to play through the entire game with you're friends, and while many whine about this, that's how the game was developed. It's not an issue or a bug they need to fix nor is it ""clunky"", it's how they chose to implement multi-player into the game. Yes, the keyboard and mouse controls are terrible, but this is a studio that doesn't make PC games, Dark Souls was their first attempt at a port and Dark Souls 2 is their second. It blows that you have to use a controller to play the game comfortably but you don't HAVE to. I used  the PC controls for about 3 hours and while they are a bit odd and uncomfortable, the game is completely playable using keyboard and mouse. Now lets actually talk about the game.Now Dark Souls 2 is an amazing game, from the visuals to the gameplay, it stays true to the Souls series. The game looks brilliant and it's color palette is wonderful, they optimized the heck out of it and the game runs incredibly even with all the settings turned up to the max on mid-range PC's.I feel it's a bit harder than the first as well, and the main reason behind that is that weapons now degrade a lot faster. Enemies are more aggressive and bosses need a little bit more strategy than previous titles, more than once I have underestimated the enemy and in the end paid dearly for my mistake. Control responsiveness is great, never once have I been screwed over because my input didn't go through. The world you're in is amazing, the level design is just as good as Dark Souls 1, and the enviroment feels more immersive. My only one gripe is that your weapons break far to quickly, you can now equip three items to each hand, but that doesn't make up for it. It's really annoying how quickly you can get into trouble when your weapon breaks and you have to high-tail out of a fight. Not even upgrading your weapon improves it's durability. There is and item you can equip that you find later in-game that slows the degradation of you weapons, so that's nice, but I wish upgrading improved their durability. Dark Souls 2 is everything I hoped for in another Souls game, and anyone that says their a Souls fan and then says they were disappointed with this game is not a Souls fan.…"
8,"I am writing second review after beating game.In the first review I gave ds2 9/10(played that time only 5-10 hours), certainly I must say that in 55 hour long playthrproough (with almost all bosses (except Vendrick )) I had no freezes, no lags, 0 problems with game. I should start with s of this game. It is dark souls,  it has beautiful lore, awesome gameplay, magnificent views (myI am writing second review after beating game.In the first review I gave ds2 9/10(played that time only 5-10 hours), certainly I must say that in 55 hour long playthrproough (with almost all bosses (except Vendrick )) I had no freezes, no lags, 0 problems with game. I should start with s of this game. It is dark souls,  it has beautiful lore, awesome gameplay, magnificent views (my favourite location is Dragon Aerie), hardness and my favourite... you kill bosses and progress not with level or high damage sword, but with skill. Some bosses are unique and interesting. PVP or Jolly co-op is just awesome (after I defeat boss on my own, I like to help others). There are added tons of items and mechanics what make game better. And the ending is quite good.Now about cons. and I found only one big flaw what made me sad, it is bosses. The problem is, that there is too much knight bosses, and sometimes they even repeat. Few bosses are just copy/pasted from ds1(like scorpion lady(ds2) and spider lady(ds1)). Well I must admit that ornstein is copied for lore and his attack are different, so I wouldn't count him as flaw, but sometimes you just feel thet it's too familiar, in a bad way. Another con for bosses is hardness, you meat Persuer (just a knight) and this is your nightmare(and yes, only after I defeated him, I received an info of 90% easy damage, but the way I defeated him as knight was even better) . Then you meet an awesome dragon in cage and he dies from 10 hits or you meet Lord of Giants( who should be hard as hell and awesome in this way)... I killed him on 2nd try. And final boss wasn't **** but he/she was disappointingIn sum-up I can say, that this is great sequel, not perfect, but great one. If you just compare with what came out in 2013/2014 (bugged and not finished bf4, simcity, Rome:TW2 and others) DS2 is best right now you can get in 2014(for me). DS2 receive from me 8.5/10. Great game and great sequel. I would add one more plus point if they add steamworkshop (new gear, funny mods, fantasy of fans). Right now I'm replaying game with same character I did before and I receive many new enemies and test my skill. Praise... well, you know what to do.…"
10,"This is an excellent PC port of an excellent game!For one, people on here are trying to bash it and I'm not positive as to why... But the game runs at 40-60 fps on my laptop with medium-high settings. It's gorgeous and fluid.It's still recommended that you use a controller for the game, makes everything a bit easier. Just get a 360 controller for your PC.The game itself isThis is an excellent PC port of an excellent game!For one, people on here are trying to bash it and I'm not positive as to why... But the game runs at 40-60 fps on my laptop with medium-high settings. It's gorgeous and fluid.It's still recommended that you use a controller for the game, makes everything a bit easier. Just get a 360 controller for your PC.The game itself is wonderful, brutally challenging and extremely rewarding for when you do get through a tough spot.Plus, for the 50 dollar price, it's really hard to resist. Pick it up and start playing this amazing game!…"
10,"People who rated this game negative don't know anything about souls games and should have just un-install the game. This game is just simply not for you guys..."
10,"this is the game of made by godi wait many times and from never break my expectand after, i wait darksouls3 i want see more 'YOU DIED'best game of my life . 1,2 both"
9,"Dark Souls II is difficult. In fact, it's probably the most difficult game I've ever played in my life, but I enjoyed every second of it.While off-putting at first, Dark Souls II pulls you in with it's exacting gameplay, brutal difficulty and rewarding bosses, every time I finally defeated a beautifully designed boss I felt I actually accomplished something, and I can't say that forDark Souls II is difficult. In fact, it's probably the most difficult game I've ever played in my life, but I enjoyed every second of it.While off-putting at first, Dark Souls II pulls you in with it's exacting gameplay, brutal difficulty and rewarding bosses, every time I finally defeated a beautifully designed boss I felt I actually accomplished something, and I can't say that for most games I've played.One of my only gripes with the game is that at times it is difficult to know where to go next, while I respect that they don't explain much I wish that they would have at least given me a general direction of where to go next.In my opinion, this is my first Game Of The Year contender for 2014.…"
9,"I bought the first DS and played about 30 minutes before shelving it because it was so broken. I'm glad I gave From another chance. This is not a perfect game but the things it does well it does extremely well. Yes this game pretty much requires a gamepad, and yes it looks like a steaming pile of crap compared to other PC RPG offerings like The Witcher, but aside from that I have a hardI bought the first DS and played about 30 minutes before shelving it because it was so broken. I'm glad I gave From another chance. This is not a perfect game but the things it does well it does extremely well. Yes this game pretty much requires a gamepad, and yes it looks like a steaming pile of crap compared to other PC RPG offerings like The Witcher, but aside from that I have a hard time thinking of negative things to say about the PC version.It's difficult, sometimes frustratingly so, but not in an unfair way. The world is incredibly well designed, and the game never holds your hand through anything. As you progress you get actually feel like you've accomplished something, and when you fail (which you will -- a lot) you need to exercise patience and sound strategy to overcome. I wish every game I purchased played out like that. The class creation system is deep and allows for tons of possibilities (kinda like how Blizzard games used to be before they determined everyone was too stupid to put points into attributes by themselves). And da 30+ boss fights and creature variation?... Awesome. Nearly everything about this game is excellent, reminds me of how action RPG's used to be and should be.9/10 Would Die Again…"
9,"When Dark Souls 2 was finally released in 2014, it set the stage for what would be considered ‘difficult’ in the gaming world, ironing out the unsavoury parts of its previous title and redefining difficulty in its challenging boss fights and pvp, rather than challenging environment and controls. Upon starting the game, the player is thrown into the tutorial area, which is littered withWhen Dark Souls 2 was finally released in 2014, it set the stage for what would be considered ‘difficult’ in the gaming world, ironing out the unsavoury parts of its previous title and redefining difficulty in its challenging boss fights and pvp, rather than challenging environment and controls. Upon starting the game, the player is thrown into the tutorial area, which is littered with secrets and Easter eggs for its more experienced players. Here, the player will learn how to parry, backstab and all the other skilful combat manoeuvres that made Dark Souls 1 so rewarding.Alongside a more refined gameplay, Dark Souls 2 is paired with a deep storyline to rival that of even Skyrim and similar titles, despite being completely separate from its previous title, both are still, unsurprisingly, set in the DS universe. The player begins as a cursed undead, doomed to remain between life and death forever and to eventually become ‘hollow’, a zombie-like being with no memories or purpose. In order to break this curse, the player is tasked with collecting four Great Souls from powerful ancient beings known as Old Ones, an undoubtedly daunting mission.The aesthetics of the game perfectly complement its lonely, harsh atmosphere, the graphics are very realistic and the fantasy element of the game is only really shown in the terrifying beasts and ghouls that face the player, even they are eerily realistic. As for the technical side, I did personally experience occasional framerate issues even on PC, let alone consoles at the time. I, however, did find the game very playable despite this.The loneliness of the game creates perfectly compliments its NPCs and artificial intelligence, in the sense that the player would rather be relieved by the company of anyone than have to go through the whole game alone. For example, by the end of the game most have become ridiculously attached to the being known as ‘snuggly’, who is never even actually seen in the game, though is assumed to be a crow-like humanoid and who’s character is developed through Easter eggs and adorably broken English.In summary, Dark Souls 2 is my personal favourite of the series, surpassing both its previous title and even its following title with unrivaled atmosphere and terrifyingly monstrous bosses.…"
5,"Huge disappointment. I didn't finish the game. It was nothing like first 2 games, only soul DS II has is in its title. I couldn't believe how plain and empty world felt. Not even a single memorable location in 25h of gameplay, non-existing plot (not like it was good in DS I but at least you had idea of what you are doing), boring repetitive enemies and very poorly made boss fights (screwHuge disappointment. I didn't finish the game. It was nothing like first 2 games, only soul DS II has is in its title. I couldn't believe how plain and empty world felt. Not even a single memorable location in 25h of gameplay, non-existing plot (not like it was good in DS I but at least you had idea of what you are doing), boring repetitive enemies and very poorly made boss fights (screw creativity! Let’s make one average boss and make player fight 5 of them at once! That will be 5 times more fun!).  25h from which I enjoyed maybe 2-3 hours. I'll better just finish ng+5 in DS I.…"
