"score","review"
7,"There's a lot to say about this game so I broke it down into three catagories: The Good, The Bad, and The Ugly. Skip to the bottom for a synopsis.The Good:+DaS2 is still huge. There is a lot to explore and there's plenty of hidden areas with tough bosses.+A larger, more open game world.+More character interaction. Much of the lore is fleshed out via NPCs as you journey throughThere's a lot to say about this game so I broke it down into three catagories: The Good, The Bad, and The Ugly. Skip to the bottom for a synopsis.The Good:+DaS2 is still huge. There is a lot to explore and there's plenty of hidden areas with tough bosses.+A larger, more open game world.+More character interaction. Much of the lore is fleshed out via NPCs as you journey through the game, with characters having more to say (and more to sell).+Better networking and better co-op. A new ring essentially makes your summon sign only visible to your friends.+More accessible covenants. While most covenants in DaS you had to jump through hoops just to find, overall DaS2's covenants are easy to join and more enjoyable to level.+Dual wielding is greatly improved. Power stancing lets you swing both your weapons in new combos.+Magic is greatly expanded and includes a new catagory for Hexes.+Greatly improved NG+ experience. Bosses drop new items, new enemies spawn in special areas, and some bosses gain new mechanics.The Bad (huge problems that will [probably] never change):-Terrible map design. Most levels are very simplistic, with some even being a straight corridor from beginning to the token boss.-Heavily unbalanced covenant rank-up requirements. Heirs of the Sun's 30 sunlight medals can be achieved in a few hours for max rank, while BoB & Blue Sentinel's 500 kills requires NG+ or nonstop victories in the arena (losses count as -1 rank points... why?).-Overabundance of forgettable, humanoid bosses. Some are recycled later in the game (or later playthroughs) as normal mobs or bosses. Many bosses have similar attack patterns and fall apart when you circle strafe and roll.-Swarms of enemies everywhere. While DaS focused on intense 1v1 fights, there were occasional cannon fodder slaughterfests. DaS 2 will regularly throw multiple heavily armored & long-reaching (polearms, ultra greatswords) enemies at you.-Parrying and riposting are harder to perform and less rewarding. Even if you manage to riposte, you can now be damaged while riposting by the swarms of enemies in DaS 2.-Overabundance of healing items and consumables. There's no reason to start as a Cleric because of 3 different purchasable lifegems (HoT consumable), 12 Estus Flask+5s (easily attained on first playthrough), and 8 other consumables that restore spells or cure statuses on top of healing you.-Terrible plot and story telling. The last few levels (and especially the ending cutscene) make no sense and it feels like the devs just wanted to add ""cool"" stuff to pad the game.The Ugly (nitpicking and balance problems):*Iframes have been removed from backstabs, ripostes, using fog gates, doors, and other environmental actions.*Roll iframes & estus flask drinking speed are tied to a stat.*No pyromancer starting class. You have to get roughly through one-quarter of the game to find your first flame and pyromancy and its very easy to miss.*Tons of balance issues with both PvE & PvP. Near the end of the first playthrough magic becomes very powerful, even in PvE. In PvP most spells worth using in PvP will kill you in 1 or 2 hits even with strong magic defense.*No un-cracked Red/Blue Eye Orbs and cracked orbs aren't sold by NPCs until NG+.*Changes to equip load mean everyone is some kind of hybrid class, doing normal rolls while wearing full Havels with a cloud of Persuers- err, i mean Affinity over them while waving a flaming katana around.*Cheaters are currently a huge issue on the PC version. You can now be invaded while Hollow and not being human is a big HP handicap, meaning you will run into cheaters much more often than in DaS.Dark Souls 2 isn't much of an honest sequel to Dark Souls; Being more akin to a numbered Final Fantasy sequel, with the only connection between the two being some equipment & spell names as far as I can tell. While it will win tons of GOTY awards, it also has a ton of issues that need to be addressed before it will be remembered as fondly as its predecessor. DaS 2 is definitely worth playing, but it feels like a rushed cash-in made by a B-Team who were told how a Souls game should be made (and then went and did their own thing anyway). Hopefully FromSoft's next Souls game has some actual soul to it... Otherwise we might just end up with another Armored Core situation with a new half-assed sequel being pooped out every few years.…"
2,"After playing it for more than 100+ hours combined through Steam & other means of playing it I can safely say that it is terrible & it will always be terrible. The game itself griefs you in its overall design. It's like, that **** at a party who's just there to be an **** He wants to make you have a bad time, piss you off & **** your girlfriend while you're tied down forced to watch.After playing it for more than 100+ hours combined through Steam & other means of playing it I can safely say that it is terrible & it will always be terrible. The game itself griefs you in its overall design. It's like, that **** at a party who's just there to be an **** He wants to make you have a bad time, piss you off & **** your girlfriend while you're tied down forced to watch. That's pretty much DS2 in a nutshell. A hard game for the sake of being hard & an **** for the sake of being an **** **** this game in its entirety…"
1,"terrible graphics. no story. everything can kill you like you were nothing, and then you lose all your progress.  Character creation is terrible. The gear looks awful. The controls are counter intuitive. There are still no way to pause the game (so if you have a life, forget this game).  You cant even select the difficulty level. Give a extra super elite difficulty level for the gameterrible graphics. no story. everything can kill you like you were nothing, and then you lose all your progress.  Character creation is terrible. The gear looks awful. The controls are counter intuitive. There are still no way to pause the game (so if you have a life, forget this game).  You cant even select the difficulty level. Give a extra super elite difficulty level for the game fanatics to shut them up and make them feel like they were atlease half of a man playing your game in their mother's basement. And give us a casual setting for the people that come back from a hard days work and just wanna chill and relax.…"
1,"I strongly dis-recommend this game.I don't mind hardcore games, I don't mind extremely hard games that require me to retry the same part hundreds of times.But dodging a monster for it to be able to turn towards you *during* it's attack is unacceptable for me, but that's the least of an issue with this game.The PC version is not made to be played with a controller.But the PC versionI strongly dis-recommend this game.I don't mind hardcore games, I don't mind extremely hard games that require me to retry the same part hundreds of times.But dodging a monster for it to be able to turn towards you *during* it's attack is unacceptable for me, but that's the least of an issue with this game.The PC version is not made to be played with a controller.But the PC version is not made to be played with a mouse and keyboard either...All the graphics recommend controller buttons, yet it is impossible to customize the controls on the controller.I desperately wanted to like this game seeing all the good reviews I saw of it and when I began playing, I already expected it to be hard and likely very frustrating, but I certainly did not expect the many flaws of the game and the lazy developers.To finish it all off, the game is online and you can get banned for modding even though it's mainly a single player game, no thanks.I regret my purchase, maybe it would've been worth it for 2$ but certainly not 28$.…"
10,"I think that these negative reviews are probably just from people who can't figure out how to play the game! This is a masterpiece of a game, the graphics are beautiful and the challenge can be rage inducing but when you beat it, there is no greater feeling in the world."
5,"Nothing like the Original.  The changes to riposte or back stabs are just junk.  Mobs don't even re-spawn after you try to farm them for an item.  Story is not that great or even the Lore.  Kinda sad but still playable."
7,"While a good, solid game in its own right, ""Dark Souls II"" is ultimately somewhat of a step backward from its predecessor.The change in directors is evident in the form of a weaker plot, inconsistent world-building, lack of variety in enemies, and aggravating changes in combat mechanics (such as increased enemy tracking) which come off more as difficulty for difficulty's sake ratherWhile a good, solid game in its own right, ""Dark Souls II"" is ultimately somewhat of a step backward from its predecessor.The change in directors is evident in the form of a weaker plot, inconsistent world-building, lack of variety in enemies, and aggravating changes in combat mechanics (such as increased enemy tracking) which come off more as difficulty for difficulty's sake rather than to offer a rewarding challenge to players. In addition, while not necessarily a problem the apparent downgrade in graphics and lighting may come as a slight disappointment to fans.Overall, ""Dark Souls II"" is a flawed, yet serviceable entry in the ""Souls"" series, and the aforementioned issues are possibly just growing pains from the change in direction that will hopefully be ironed out in future installments.…"
5,"I have played Dark Souls II for many hours completing a full play through and half of NG+. The most annoying thing I have noticed is the lack of boss variation. Most of the bosses are some form of humanoid creature or knight. There is the big Jabba The Hut looking thing and also the rat king boss but other than that they are all the same. I beat 90% of the bosses by either strafing to theI have played Dark Souls II for many hours completing a full play through and half of NG+. The most annoying thing I have noticed is the lack of boss variation. Most of the bosses are some form of humanoid creature or knight. There is the big Jabba The Hut looking thing and also the rat king boss but other than that they are all the same. I beat 90% of the bosses by either strafing to the left or right because of this. If you some how could not beat a boss you could always summon the phantom NPC to help you which are there for most bosses and since it is really easy to stay human that option is always there and make the fight an almost guaranteed win. The dragons were just plain weak which was very disappointing. There really were no mini bosses that were a challenge. It seems the developers made it sound like it was going to be much more difficult to get more sales because it was definitely  not a challenge. The boss weapons were all crap. No point in even saving the boss souls for them because the ones that were good had some major flaw like the durability was low or something. Dying is not a big deal in Dark Souls II because you only lose a very small fraction of your health. On my third character I was able to make it through the entire game and only died about 7 times due to stupidity such as falling off a cliff or something. The conditions, such as poison or curse, barely do anything to even a character that is not resistant to them. On top of that the targeting system is jacked and rarely works how you want it to. The covenants are great if you love multiplayer but if you do not there are only a select few that will benefit you offline. With that being said there are a few things that were good about the game.One thing I thought was a major improvement was the PC controls. They are a little confusing at first but after a while of messing around with them it is just like playing any other game. The graphics are awesome and the developers did an amazing job on that but can also be scaled down far enough to work on a crap PC. The bonfire jumping, although it makes the game easier, I thought it was an improvement. There are also many easily missed secrets which may keep you interested through your second play through.I would rate the individual parts of the game as follows.Graphics 10/10Controls 9/10Gameplay 2/10Difficulty 1/10Multiplayer 5/10To sum this up I would say it is a fun game but if you want a true souls game play Demon Souls or the first Dark Souls because the developers like many others are just pumping these things out for money now.…"
4,"The game is not supposed to be played with keyboard+mouse. You have to google how to play this game with keyboard and mouse and download and run some scripts before you can play this game using a regular gaming PC. I am quite sure that the people who are giving this game anything above 5 are doing so for non-PC version of this game. The least the game developers should have done is to showThe game is not supposed to be played with keyboard+mouse. You have to google how to play this game with keyboard and mouse and download and run some scripts before you can play this game using a regular gaming PC. I am quite sure that the people who are giving this game anything above 5 are doing so for non-PC version of this game. The least the game developers should have done is to show the correct key-bindings (instead of a triangle) while interacting with the environment. These are the reasons that I doubt I will ever be finishing this game.…"
9,"Never have I been so close to ragequitting/uninstalling a game only to end up enjoying every second of it. Steep learning curve and a throwback to when games were actually challenging and didn't hold your hand all the way through.  Intense atmosphere and thrilling gameplay. So many various routes to take to play through and a very rewarding sense of accomplishment every time you make itNever have I been so close to ragequitting/uninstalling a game only to end up enjoying every second of it. Steep learning curve and a throwback to when games were actually challenging and didn't hold your hand all the way through.  Intense atmosphere and thrilling gameplay. So many various routes to take to play through and a very rewarding sense of accomplishment every time you make it past that seemingly undefeatable boss.  Runs flawlessly on PC at the time of my purchase. Not a scrappy co sole port like some user's have suggested. An Xbox controller recommended for the best experience.…"
7,"Realy boring combat just hit and roll hit and roll, ill give it a 7 because it is still a good score, could have more difficulty options and a hc mode if character dies then its the end of it."
10,"Amazing game! Unusual and incredibly hard! I cant remember how many times I felt so frustrated in a single game. Hundreds of deaths, ton of butthurt and fun! I played on my big tv at the evening with gamepad and I didnt meet any problems other people talk here. That was awesome! It is super cool if the game is hard."
10,"Great game and decent port.Still not the ""great PC experience"" the developpers promised us, but it has a solid framerate and if you have a controller, Dark Souls 2 is a lot of fun. I highly recommend it."
10,"The game runs very well. Dark Souls 2 is superior to Dark Souls 1 in every way except they don't have Solaire. But besides that, you can still praise the sun. Dark Souls 2 had more memorable characters that you can relate to. Not everything is all Dank and Dark. There are some very bright places which make you want to go back there again. However, the story is still strong with its lore,The game runs very well. Dark Souls 2 is superior to Dark Souls 1 in every way except they don't have Solaire. But besides that, you can still praise the sun. Dark Souls 2 had more memorable characters that you can relate to. Not everything is all Dank and Dark. There are some very bright places which make you want to go back there again. However, the story is still strong with its lore, but just like the original Dark Souls, it's presentation is terrible. It's as bad as the original game that you need to look up Youtube videos explaining it. The game could have used more cut-scenes. But unlike most games, this game puts up a decent challenge but Magic is still overpowered. And too many **** spam it all the time that you need a big ass magic shield to carry with you. It's a great game. A worthy successor. I only wished that they had better storytelling.…"
7,"This is my revised review without playing DS1 before . At my first time play through, I gave this game 0 out of 10 because of terrible port. I almost ditched this game but on a second thought, I gave it another try by overlooking bad port and poor graphic. This time I really enjoyed the game. I spent 100 hours+ with this game, played it till the end and still want to play more so I wouldThis is my revised review without playing DS1 before . At my first time play through, I gave this game 0 out of 10 because of terrible port. I almost ditched this game but on a second thought, I gave it another try by overlooking bad port and poor graphic. This time I really enjoyed the game. I spent 100 hours+ with this game, played it till the end and still want to play more so I would like you guys to read my review first, you will understand why this game has a lot of lovers and haters at the same time, and whether this game suits your taste or not.Let me start with the bad port first. As many negative reviewers said, this game has a abysmal console port EVER !. If you have controller, you will not have the issue. Nevertheless, if you have only keyboard + mouse, You will have to spend 1-2 hours  learning how to play with keyboard. Even after you know how to do every moveset, you still have a delay. Anyway,  you still can play this game with keyboard + mouse. Me too struggled at first but now totally fine.Second, the Graphic is unacceptable if you compare to PC RPG game nowadays. So even without keyboard issue, this game cannot get perfect score. No zooming to the face when you talk to NPC, NPC mouth is shut. Character creation is bare bone. Begining cinematic is a lie. You will not see cinematic like that again in the game. The only cinematics left are seen when you fight a boss, which most of them are mediocre.Third, there is a very little story in this game, or I could say this game has no story at all, no quest or whatever. You just have to put yourself through the end of the game, that's it. This game is pretty much like a hack&slash game if you ask me.However, even with these very poor features, this game still has its huge merit, that is THE CHARISMA of the game. or in another word, THE CHALLENGE, which is very unique if it is compared with most RPG games in the market. EVERY TIME YOU DIE, THE GAME WILL PUNISH YOU, this concept adds the unique tense that I never had before in other games. Every death will decrease your maximum HP 5 - 10% per time and If you die again before getting to the spot that you just died, you will lose all your souls accumulated, which can be a huge loss since you have to use souls to up your lv and spend stuffs. Of course, you cannot save your game. This rule will force you focus on the game and be cautious to every corner, traps and  enemy. ""I must survive ! I must not die"" these are what you will chanting in your mind while playing the game. There are checkpoints (bonfire) available though, however many times checkpoints are far from each other, so if you die along the way, you will have to run from the start again.Game Mechanic is also very awesome. I blamed it in my first review but that was because of my inexperience. This game when you click attack button, it means you just committed the attack, you cannot cancel it and you will be vulnerable at that time. This force you to play more carefully. Most of enemies in the game can be defeated only  by skill not by your lv or equipment.  You just need to understand its attack-pattern, dodge and attack at the right time. Boss's fights are so epic and super excited. I still remember how hard when I fought will Last Giant, the first boss and Pursuer, the second boss first time. I spent more than 2 hours to beat them. I died a lot, many times I made mistakes just when I was about to finished them off ( wanna cry). I even almost gave up. However, after I defeated them, I felt very satisfied. The feeling that you conquer the game on your own perseverance will emerge.To me, there is no game giving the winning feeling as big as this one.Multiplayer, another thing that I must mention no matter what. This game has a VERY GOOD MULTIPLAYER, which I've never expected from RPG games. PVE, you can summon your friends to help you fight or can go to help in your friend's world. Thus, if you feel like the game is too hard, you can summon help anytime. More importantly, PVP IS THE BEAST, fighting the others is very fun. A lot of weapon have its own moveset, making the fight very diverse. There is no best weapon nor best armor in the game. Moreover, you can invade the other's world forcefully by using items, ambush poor guy while he is busy with his monsters, or be invaded yourself, or even become a helper who helps newbie fight with invader. However, for me, in a high lv 200+, the game will start to be less fun in PVP since everyone will use the same style due to the stat  soft cap and soul mem matching is unreasonable.In sum, I have a lot of fun with this game but I cannot give perfect score because those bad aspects. So here is my quick brief reviewIF YOU WANT THE GAME WITH AN AMAZING GRAPHIC, EXCELLENT STORY that has various of choices and memorable NPC. This game is absolutely ์NOT for you.However, IF YOU WANT A INTENSE CHALLENGING GAMEPLAY and GREAT PVP, this game is a must try !. I hope DLC will come soon :>…"
10,"this game is so fun and amazing when I first got on after 2 min I instantly died after sometime I got the hang of it and tried online overall this game is great and people should check it out"
9,"Few times you're going to cross with such a well constructed game. There are critics to it but in this rare case none can ever change the fact that this is an absolute masterpiece, enjoyable from the begining to the end. It is a hardcore game and if you don't want challenges, this is not for you. The game is mysterious and unforgivable, you're going to die a lot. But don't worry, thereFew times you're going to cross with such a well constructed game. There are critics to it but in this rare case none can ever change the fact that this is an absolute masterpiece, enjoyable from the begining to the end. It is a hardcore game and if you don't want challenges, this is not for you. The game is mysterious and unforgivable, you're going to die a lot. But don't worry, there will be plenty of rewards and each weapon or costume you receive will look like water in the desert, an eternal relief and a great hope for the future of your journey.Now, to the criticism. Firstly, the multiplayer: it is enjoyable for a while, but then you encounter the inevitable jerks who are virtually undefeatable due to overpowered weapons. Secondly, the ending is just so vague, sudden and anti-climatic... it is not the same as the first one where vagueness gave it a certain charm or glamour, now it feels like someone ran dry of ideas and tried to terminate the project before it went downhill.Nevertheless, a collection item, one day this will be remembered certainly as one of the best games of the decade.…"
9,"Dark Souls 2 is a masterpiece.  Well, almost a masterpiece. Dark Souls 2 is VERY challenging. However, not as challenging as the first, and probably more approachable to newcomers of the series.  First off, the gameplay is amazing.  I found myself sitting through late hours of the night mashing away at cruel and punishing enemies.  I died, ALOT.  But thats a part of the games appeal.  WhenDark Souls 2 is a masterpiece.  Well, almost a masterpiece. Dark Souls 2 is VERY challenging. However, not as challenging as the first, and probably more approachable to newcomers of the series.  First off, the gameplay is amazing.  I found myself sitting through late hours of the night mashing away at cruel and punishing enemies.  I died, ALOT.  But thats a part of the games appeal.  When you finally get through that tough boss that took you hours to finish, its one of the most rewarding experiences you will ever feel.  Besides the gameplay (which is near perfect), the lore is also a very interesting part of the game's story as well.  Dark souls 2 isnt direct with its story line at all.  In fact, the only way your going to  end up understanding most of the story behind different bosses, or the land of Drangilec, is by reading up on the history of specific  items and souls you get through the game.  You'll also be able to talk to different npcs during your playthrough.  The reason im not giving this game a perfect score is because doesnt feel all that original.  Many bosses, weapons, and even some different areas of the game all feel like they were almost copy and pasted from the original Dark Souls.  Also, the game doesnt always feel 100% fair like the first one did.  What i mean by this, is that in some areas of the game, you'll encounter enemies or bosses that'll slide and move in your direction as you try to evade.  You'll understand if you play the game, and i HIGHLY recommend that you play this near masterpiece.…"
