"score","review"
2,"After hearing about the problems the first Dark Souls game had on PC, I put off buying it until I knew that some of its problems had been fixed by the developers or modders, or that there certainly wasn't going to be any further improvement. I was disappointed to find that it only showed the XBox controller buttons in place of the keyboard commands and it took some rebinding to getAfter hearing about the problems the first Dark Souls game had on PC, I put off buying it until I knew that some of its problems had been fixed by the developers or modders, or that there certainly wasn't going to be any further improvement. I was disappointed to find that it only showed the XBox controller buttons in place of the keyboard commands and it took some rebinding to get keyboard and mouse rebound to a functional set-up but I was ultimately treated to a fantastic game. The atmosphere in Dark Souls, as well as its environmental storytelling and bosses were all phenomenal, and I've sunk many long hours into the game.I've therefore been waiting with a great deal of excitement for Dark Souls 2. Dark Souls was a rushed port in response to high PC player demand so some problems were expected, but surely there wouldn't be any with Dark Souls 2, which was developed for PC simultaneously ... Wrong! The Xbox controller prompts are back. The default bindings are appalling, and many keyboard buttons can't actually be bound for no apparent reason. The controls are laggy in a game were rapid responsiveness are key. There's also the more minor issue of the massive downgrade in the lighting of the game, which hopefully may be fixed at some point for PC.In short, this is once again an embarrassingly bad port, and I'd advise waiting for fixes from the developers or modders before getting it. What I've played of the game itself seems great, but it's simply not a finished product and I object to being sold games in this condition.…"
0,"This game don't work.The game crash everytime you enter, and the company dont launch a fix, 3 days after his launch.Thanks for stole my money!Ah, and the game doesn't have a pc controller instructions, is a BAD port from the console version.$50 for a bad port."
0,"The game will not load on my pc, and a lot of other peoples at that.  There is no Tech support to call, there is no disclaimer that it may not work, and there is no refund.  Its a very shameful process. That I wish I was not a part of.If you are buying this game, you are gambling with your money.It may not work, and there is nothing you can do about it."
1,"Had to spend 4 hours trying to get past the infamous ""White screen"" which crashed the game at launch - the only way to get past was unplugging the monitor while launching it, replugging when it was in the menus.Anyways the GAME! I enjoyed Dark Souls 1 but this has clunky Controllers, feels like there is alot of delay and a frustrating camera that does not navigate well - runningHad to spend 4 hours trying to get past the infamous ""White screen"" which crashed the game at launch - the only way to get past was unplugging the monitor while launching it, replugging when it was in the menus.Anyways the GAME! I enjoyed Dark Souls 1 but this has clunky Controllers, feels like there is alot of delay and a frustrating camera that does not navigate well - running backwards does not turn the camera round, just the character - falling off a Cliff by accident while ""kiting"" a boss because the camera does not show where you are running -is not my kind of fun.Another frustrating thing is that the menus has XBOX 360 (!!) buttons and keys in the menus - so you have to Guess which keys correnspond to those on the keyboard - making it worse if that you cannot rebind all the keys in the game, making the game quite unplesant if you use a keyboard and mouse - thankfully I do have a Controller - but it still feels very clunky when moving, it feels like Your character doesn't have fluid movement but rotates/moves at an 8 axis.Also a warning to whoever has a VAC Ban: Dont buy, you will NOT be able to acess the game servers even if you were banned 10 years ago!…"
0,"The game is awful. Enemies moves are too predictable. Maps are terrible too, its just a lot of tight corridors. Your character moves like a snail, it takes two hours for your character to response to a pressed button. Its hard in a way that is unfair which is not something to be praised. DO NOT BUY."
0,"Broken and awkward!  I can't jump, among other things that don't work right.  The controls are terrible.  I actually am contemplating asking Steam for a refund it is so bad.  Betas of other games are better than this ""finished"" product."
4,"It's a great game whatsoever, great playability but I see some flaws in it: sometimes my attack, almost touching the enemy doesn't do any kind of damage on the hollows and the bug that wasn't fixed till now take me away from playing it in my big picture HDMI TV that turns out to be a real letdown."
3,"What a horrible port,its even worse then the dark souls 1 port IMHO .I would spend my money on something else if i where you.The biggest problem people seems to have is getting pass the start up crash.Yeah they promised a better port,the game isn't even working for some people,skip this pile of .... or if your realy hell bound to buy it wait for them to fix all the problems."
0,"This game might be good, might be. But I can't to play past the first 20 minutes? Why? Because the controls are **** unplayable on keyboard and mouse. I refuse to buy extra hardware i.e. a gamepad because a company is inept at providing a decent service and lied saying that it could. otherwise I wouldn't have bought this piece of **** in the first place."
0,"still not able to play due to the problem of the hdmi if I had the tv and monitor connected error, and so far the company has not done anything already nearly 200 pages of complaints on steam and nothing yet. shameful"
1,"I seldom give games low or high scores unless they are uttlery outstanding in some way.Dark Souls II is an outstandingly bad console port.  I assume.  I haven't managed to start it yet as it immediately crashes back to the desktop.Couple this with feedback that keyboard and mouse controls are broken and that modding the game to fix it is a bannable offence and there's not a lotI seldom give games low or high scores unless they are uttlery outstanding in some way.Dark Souls II is an outstandingly bad console port.  I assume.  I haven't managed to start it yet as it immediately crashes back to the desktop.Couple this with feedback that keyboard and mouse controls are broken and that modding the game to fix it is a bannable offence and there's not a lot left.A sincere pity that Dark Souls II is pile of trash because I really, really, really enjoyed the first one.…"
1,"Relative to the time of release, DS2 for PC is somehow an even crappier port than its predecessor, It looks bad, it sounds bad and yep, it plays like utter ****Funny thing is I saw this coming a mile away, so of course I didn't buy it. A company that knew the original Dark souls was a pathetic excuse for a PC release NEVER BOTHERED TO PATCH IT!! After all this time, Of course they willRelative to the time of release, DS2 for PC is somehow an even crappier port than its predecessor, It looks bad, it sounds bad and yep, it plays like utter ****Funny thing is I saw this coming a mile away, so of course I didn't buy it. A company that knew the original Dark souls was a pathetic excuse for a PC release NEVER BOTHERED TO PATCH IT!! After all this time, Of course they will treat PC gamers like idiots again for the sequel.Its the exact same deal this time around- What you pay for is the dregs of an average console game, that looks and plays like a ps2 game, even the sound is atrocious, I couldn't stand to play more than an hour of this insulting trash.…"
2,"I still remember how frustrated I felt when the first Dark Souls came to PC, and it was THE worst port I had ever played on pc (and I have a long history with BAD ports). Luckily for me, there were a bunch of fans that fixed the company work for us gamers without asking for a single penny, so I ended up enjoying the game I had bought (half of my money should have been to those guys whoI still remember how frustrated I felt when the first Dark Souls came to PC, and it was THE worst port I had ever played on pc (and I have a long history with BAD ports). Luckily for me, there were a bunch of fans that fixed the company work for us gamers without asking for a single penny, so I ended up enjoying the game I had bought (half of my money should have been to those guys who fixed the game), and I remembering me thinking ""they wont do this again, right? The backlash was pretty hard on them"" well yesterday I bought this game (the sequel) and I'm already feeling like I will need those guys who fixed the first one again! Really?. For starters, it doesn't initiate if I have my controller plugged onto the pc, it just crashes, so I cant play it with my controller (not that I would like it but, It's the recommended way right?), amusingly enough, it doesnt seems to matter if I have my nostromo plugged into the pc or not (I tried unplugging it, plugging it with the controller, plugging the controller alone, etc) and guess why it doesnt matter? because it doesnt recognize it. So that leaves me out with traditional keyboard and mouse, so ok. I try to start the game: CTD!, try it again, CTD when I first move! I'm starting to have a Deja vu from the first game (which had several graphics problems that luckily those fixes from those saviors fixed for me, which made my game CTD), so I use Nvidia control center to deactivate several graphics options (rather force them) and the game stops CTDing. Yay! Who needs graphics, right? well turns out the controlls are a damn mess. Better than the first one, but not by far. So I end up getting really pissed and as a result I come here to warn people that if you buy this and have the astonishing luck that it works like intended, you will have to deal with camera and key binding issues that will have you dead not because the game is difficult, but because you will feel paralyzed by the control system.So, I'm planning to get a refund on this garbage and move on to something better from another company, a company that doesnt have his fans fixing their games for them... Oops It seems there are none of those nowadays.…"
0,"Dont bother buying this broken piece of garbage, from software should be ashamed... With tens of trials I only managed To play just once... That just Sad for a game that was supposed to go out later than the console version to tune It better..."
9,"I've played through Demon's Souls and Dark Souls, and even did SL1 runs.I've played only a couple of hours of Dark Souls 2, but let me tell you, the game's alright.For Dark Souls 2, they changed the director, and it really shows in the level design.The previous Souls games weren't intended to be masochist games. The difficulty was not the main focus, and interviews with the directorI've played through Demon's Souls and Dark Souls, and even did SL1 runs.I've played only a couple of hours of Dark Souls 2, but let me tell you, the game's alright.For Dark Souls 2, they changed the director, and it really shows in the level design.The previous Souls games weren't intended to be masochist games. The difficulty was not the main focus, and interviews with the director shows that. The director of Dark Souls 2 took a very different approach, and it shows in even the dialogue of the game.In the first few cutscenes, the player is told ""you're going to die and lose souls over and over again"", it is almost like that is coming from the developers. This wasn't seen in the previous games.The gameplay suffers from this too. The game tries way too hard to surprise you and punish you. with very predicable surprises at almost every single corner.An example of this that is very evident is the first level of the game.I'm not going to spoil it, but i'll just say that in the previous Souls games, the first levels were pretty good tutorials with fair enemies. It isn't like that in this one, you'll see what I mean if you play it.The new mechanics the game throws at you are a different, fresh, new experience.Stats are distributed differently, movement feels different, healing items are awful now, and enemies have different movesets. It's interesting to play, and in some aspects, much more difficult.I was kind of worried this game would be a casualized version of the first, I can say that I'm not dissapointed.Onto the technical aspects:The PC port is very good, a definite improvement over the first. Easy 1080p and 60 fps on an AMD 7850.I can't judge the Mouse+Keyboard controls though, because I haven't tried, but honestly, who would? A controller is a must for these types of games.Loading screens are almost non-existent just like the firstAlso, Alt+F4 is beautiful, try it out when you play it, it saves your game, fades out and exits - A counter against people that will quit during PvPSteamworks for this game is amazing! There is no ""summoning failed"" message like in the first, summoning and invading people are almost instant! The connectivity is nice and a great improvement over Games for Windows Live in the first Dark Souls.Overall, I'd recommend Dark Souls 2.It's decent, but I still like Demon's Souls the best.…"
0,"After working for 40 hours to get this game to launch, the few minutes I played were terrible. Even as the game feels like a PC port, it doesn't even feel like they tried. Sure, the game looks better than the first one, but I wouldn't care if it looked terrible. The gameplay is what matters and that's what they completely broke. BESIDES not being able to even launch the game. GG."
0,"Do not trust any reviews with a 10/10 score. Look at the steam community forum page and you'll see that over 2500 people can't even launch the game they paid for. And there is no ETA for any fix at all. If you feel like playing the lottery to know if you can even launch the game, then by all means, go ahead and spend that hard earned 50$ in cash."
9,"While the game's assets and lighting aren't quite the level of quality shown in the demo last year. They're still very pretty, and with some settings customization both in and out of game you can have it looking fantastic.Massive improvements have been made compared to the dark souls 1 pc port.  honest kb and mouse support. As well as solid graphics options in game.  But the otherWhile the game's assets and lighting aren't quite the level of quality shown in the demo last year. They're still very pretty, and with some settings customization both in and out of game you can have it looking fantastic.Massive improvements have been made compared to the dark souls 1 pc port.  honest kb and mouse support. As well as solid graphics options in game.  But the other element that makes it much better is the better integration of social features.The summon system is pivotal for a smooth play experience and is a lot of fun. Over all the story is the same minimalist breadcrumb system from ds1, but the gameplay is even crisper/sharper than it was before.More iframes (invincibility frames) have been removed so more intricate and skillful dodging is required to be able to fight enemies. As well as a strong enemy variety and well animated/telegraphed attacks allow you to see actual tactics being used.Enemies will charge at you when they see you healing, some of them can heal, and others can be baited into putting up their shield (if they have one) just by pulling out a ranged weapon.…"
0,"I can't believe I wasted my bandwidth downloading this utter junk.  So I plug my Xbox 360 controller in, it doesn't do anything (apparently this is a common bug), all the hints are for a controller so I have literally no idea what to press.  I get told to press my left stick, but no idea how to do this on a keyboard.  This game is so broken it is a bad joke.  This is unplayable on the PC.I can't believe I wasted my bandwidth downloading this utter junk.  So I plug my Xbox 360 controller in, it doesn't do anything (apparently this is a common bug), all the hints are for a controller so I have literally no idea what to press.  I get told to press my left stick, but no idea how to do this on a keyboard.  This game is so broken it is a bad joke.  This is unplayable on the PC.  If I could rewind time to this afternoon I would SO NOT PURCHASE THIS PILE OF EXCREMENT!!…"
10,"Difficulty and gameplay aside (if you're looking for that, just read the console reviews). From learned from their mistakes in DS1, and the DS2 Keyboard+Mouse controls work perfectly. Controls are smooth; graphics are smooth. It may not be the best looking PC game ever made, but this version is better than playing on a console in every way."
3,"This game seems like it has a lot of promise but the developers literally did nothing to make this PC playable. They don't give you the functionality of binding whatever keys you want to on your keyboard. For instance, to use an item I cant just change it to a key. They have an array of choices I can change too, none are what I wanted of course. They are all ctr+Left click, alt +LeftThis game seems like it has a lot of promise but the developers literally did nothing to make this PC playable. They don't give you the functionality of binding whatever keys you want to on your keyboard. For instance, to use an item I cant just change it to a key. They have an array of choices I can change too, none are what I wanted of course. They are all ctr+Left click, alt +Left click, shift + left click... Why wouldn't you just make it completely customizable  to place whatever key you want, that is rule 101 for PC. This is apparently meant for a control on PC, which is just stupid, but as someone who doesn't have one I don't want to go spend money to play a game after I already spent $50 bucks for the game itself!!!The weird console controller layout of the controls for PC makes the actual game barely playable. It doesn't seem that hard yet, the biggest struggle I find is the fact that the controls are impossible to navigate when reacting to enemies. The main reason I die is because I can't control the character enough to react to the game itself which is the worst problem you can have for a game. Another obvious flaw is the fact that when your going through tutorial area in the beginning all of the helpful signs are still in console controls! So you can't even translate to what in the world I'm suppose to do on PC to get that to happen. They even have the menus in the game still on console controls. Obvious this game is not meant for PC yet...  Nothing is hard its just lack of responsiveness and control for the user....…"
0,"What a huge, huge, HUGE, H U G E, H-U-G-E, disappointment!!It's a bare console port down to the bones!! Controls are clunky, keys rebinding is a nightmare, there is an horrible delay that plagues the mouse's movements, I found at least 3 breaking bugs, and, at times, the game doesn't even start running!!Beware! Leave it alone. Save your money for something that is worth them."
4,"This game is so overrated(which i don't understand why) that people can't see how flawed the game is.The only thing good with this game is that it is challenging."
10,"It has played out exactly the same as when I played the first Dark Souls. I was again having trouble with mobs from the very beginning (obviously not the brain dead zombies), but once again I passed the initial test, conquered my fear with my defeated enemies blood dripping down my face and I have come out the other side to witness a majestic view of the sea. To put it in a few words - I'mIt has played out exactly the same as when I played the first Dark Souls. I was again having trouble with mobs from the very beginning (obviously not the brain dead zombies), but once again I passed the initial test, conquered my fear with my defeated enemies blood dripping down my face and I have come out the other side to witness a majestic view of the sea. To put it in a few words - I'm fully enjoying the whole experience! Anything good in this world requires motivation, dedication and time and this game is no different. You put the hours and effort in and you will be greatly rewarded. By the way I have played both games on the keyboard and with a mouse without a problem. See you guys on the other side!…"
0,"Remember those old-school NES games that were insanely difficult, not due to design, but because they were technically broken?  That's what ""Dark Souls 2"" is.  Not only is it obviously a terrible PC port despite claims that PC was the lead platform (then why do enemies in the distance only animate at 30fps, why is the UI so obviously designed for console, why is M&K functionality stillRemember those old-school NES games that were insanely difficult, not due to design, but because they were technically broken?  That's what ""Dark Souls 2"" is.  Not only is it obviously a terrible PC port despite claims that PC was the lead platform (then why do enemies in the distance only animate at 30fps, why is the UI so obviously designed for console, why is M&K functionality still garbage?), but the game itself plays worse than a ""Souls"" game ever has.This is likely in large part due to this being the first ""Souls"" game that isn't made by the original ""Souls"" team.  If you need more info on this, google it, but bottom line is ""From Software"" felt that the ""Souls"" franchise had become successful enough that the people who made it good could do... whatever they're doing now, and the next entry (Dark Souls 2) could be made by ""From Software's"" B-Team.Playing as Melee is pretty much broken this time around, as enemy tracking is impossible to outpace.  In DeS/DS1, you could see them winding up for an attack and roll out of the way, but now they spin on a dime and do not stop their facing until their attack has landed.  So, instead of rolling when you see the attack coming, you have to roll during the window right before the attack lands, which is much, *much* more punishing, and *far* more difficult to execute.  DeS/DS1 were punishing but fair, DS2 is punishing for the sake of being punishing.Gone as well is the tactical one-on-one combat, not just because of the above, but because of the game's tendency to throw entire rooms of enemies at you at once.  In DeS/DS1, you could lure enemies off large packs to make them easier to handle, or if you alerted one enemy in the room you would only pull that enemy and *maybe* whoever was nearby.  In DS2, if you trigger on enemy, you trigger every enemy in the room.  This makes the focus on co-op much heavier, as you're going to *need* two other people around you spamming attacks just to clear more areas.The vast majority of boss fights are copy-pasted from DS1, and the ""new"" boss fights are just bosses that look new but use mechanics that anyone who's already played DeS/DS1 will immediately recognize.There's also the issue of item durability.  In this game, your weapons are going to degrade at a much faster rate, and the only way to restore them is to use extremely rare and highly expensive Repair powders, or resting at a bonfire.  This means that, more often than not, your favorite main-hand weapon is going to be rendered unusuable before you reach the next checkpoint.  There's also a bug in the game that makes it so swinging your weapon through enemies who are in the ""dying"" animation, or swinging your weapon and having it clip a co-op phantom, will cause it to degrade at 300% the rate as well.  These two combined make for a more naggy, OCD melee-combat experience.This is also the first time I've played a ""Souls"" game and felt like it needed a map.  ""Demon's Souls"" was split into 5 seperate worlds which made it easy to keep track of things in your head, ""Dark Souls"" was open world but everything fit together very cohesively so again it was easy to keep track of things.  ""Dark Souls 2"" feels like they threw a bunch of zones together and didn't care about how they connected to each other, they just wanted them there.  Navigating is an absolute chore.  It's entirely possible to be exploring your first time, and find yourself stuck in areas where the only way to get out is to die by jumping into a chasm/pit, or returning to a bonfire (with a spell or item).  ""DeS"" and ""DS1"" had *some* of this as well, but not nearly to the extent that ""DS2"" does.The ""Souls"" series is all about overcoming unpleasant surprises, but the only unpleasant surprise ""Dark Souls 2"" delivers is that of a mishandled entry in a beloved franchise, with the only feeling left afterwards being that of wasted time.  ""From Software"" decided they could save money by hiring lesser talent to make a game that'd get success by brand name alone.  And sales-wise, it probably worked, but from now I'm going to be far more leary when I look at the next title from ""From Software"".It's very disappointing to recognize what ""From"" has done here, because it means that the ""Souls"" franchise will never be as good as it used to.  Yet for how good the last two games were, there was still a lot of room for improvement, and now we'll never know how good this series could've been.  Like everything else, it comes down to the people in charge intentionally ruining something so they can increase their profit by a few percent.  Once that starts, there's no going back.  If they feel like they have ""f u"" money after just two big titles, then quality from here on out is only going to get worse for ""From"" titles.…"
