Year,Game,Review
2014,Dark Souls 2,"Games are simply developer-created hoops that we pay to jump through. In the case of Dark Souls 2, it¡¦s not exactly fun to do the jumping, but rather ¡§rewarding¡¨. What are you rewarded with? An emotion, a rush."
2014,Dark Souls 2,If you can ignore the still not perfect controls on PC then Dark Souls 2 is a great game for hardcore gamers that can endure some suffering. They will scream in front of the screen - out of joy and out of frustration.
2014,Dark Souls 2,"Despite the camera angle and controller issues, Dark Souls II is a great game."
2014,Dark Souls 2,"If you¡¦re a fan of hardcore games, try Dark Souls 2. It is not as memorable as its predecessor, and yet it is still a phenomenal experience."
2014,Dark Souls 2,"This game is art in the good and bad sense of the word. It represents some of the best things that video games have to offer: at its most immersive, it offers a beautifully and thoughtfully rendered world to be explored that reveals itself not just through what is seen on the screen, but through the brutal and challenging experiences the player guides the in-game avatar through. The negative part of that is that the story of the game and the motivations and reasoning behind what is happening are obscure and unclear. A lot of the onus is on the player to piece things together. This is a kind of experience that is not necessarily designed to appeal to a broad swath of people, but its pitch perfect execution and strict adherence to its draconian design principles earn it a place in the pantheon of great games."
2014,Dragon Age: Inquisition,"BioWare achieved everything that it needed to with Dragon Age: Inquisition. It revitalised a series that had suffered real brand damage in Dragon Age II, and easily stands as the best RPG we've seen in years. There is absolutely no reason to miss out on this one."
2014,Dragon Age: Inquisition,"For a fantasy game presenting dozens of hours of gameplay, Dragon Age: Inquisition largely delivers on its promises, both mechanically and in gameplay that fans will want from the third title in the series."
2014,Dragon Age: Inquisition,"Dragon Age: Inquisition is an amazing game. There really is something special about it. I know a lot of people were down on Dragon Age II, but this game redeems every issue you may have had with the last game."
2014,Dragon Age: Inquisition,"It's a gorgeous game on an epic scale. Rich in character and story, it creates a fantasy world with plausible social rules you can get lost in. It makes you feel that you aren't just exploring a new world, but helping shape it at various levels of society. Inquisition sets the bar for what a blockbuster RPG should be."
2014,Dragon Age: Inquisition,"Dragon Age: Inquisition has incredibly deep and complex parts, while still maintaining the core gameplay values that Bioware knows how to do best with their third-person action titles. The game delivers everything promised, including gorgeous visuals and a strong story. Simply put, Bioware has returned the Dragon Age series to the greatness it truly deserves."
2014,Dragon Age: Inquisition,Dragon Age Inquisition is a must play RPG on the PS4 that successfully takes the best out of both previous games to create sword and sorcery perfection.
2014,Dragon Age: Inquisition,This amazing RPG should have a place in every gamer's collection.
2014,Dragon Age: Inquisition,"Dragon Age: Inquisition is the role-playing game you¡¦ve wanted for years. You glimpsed the future and now, with a few minor exceptions, that vision has been fully realized."
2014,Dragon Age: Inquisition,"Overall, Dragon Age: Inquisition is a great game that everyone should have in their collection. It¡¦s one of the best bangs for your buck out there in terms of how much time you will clock in on this one and also in quality."
2014,Dragon Age: Inquisition,It's easily the company¡¦s greatest achievement. The expertly crafted story and the massive world meant for your exploration are just the tip of the iceberg...Easily the best RPG of the year.
2014,Dragon Age: Inquisition,"This is the return of the great Bioware, back on a path that we hope they don't leave ever again. Emotive amount and variety of content makes for an incredible adventure."
2014,Dragon Age: Inquisition,"BioWare¡¦s about to drop its mic and walk off stage...It is a paragon of multiple-path storytelling and character development. It offers a master class in intricate, customizable, multi-hero combat. And it delivers not one but ten beautiful and expansive open worlds to explore, boldly throwing down the gauntlet to rival developers."
2014,Dragon Age: Inquisition,"With a mixture of open-world exploration, entertaining combat, and top-tier characters, the team at BioWare has found a winning formula that isn¡¦t shackled to either Dragon Age: Origins or Dragon Age II. Inquisition is not defined by the traditions it returns to, but by the new directions it forges for this magnificent fantasy universe."
2014,Dragon Age: Inquisition,"Dragon Age: Inquisition puts the fate of the world in your hands in a way that few role-playing games have done before. And even after another 80 hours devoted to it, it's a world I cannot wait to return to in whatever BioWare does next. I don't know what higher praise I could give."
2014,Dragon Age: Inquisition,"If you think Bioware messed up with Dragon Age 2 and Mass Effect 3, Dragon Age: Inquisition will be your cure. Hold your breath, behold the great gaming atmosphere. Dragon Age: Inquisition brings you back to the series origins. It's one of 2014's most successful games with an impressive fighting system."
2014,Dragon Age: Inquisition,"Despite a questionable predecessor and a somewhat rushed release intime for Christmas, Bioware has managed to create a fantasticadventure that easily ranks among the best games of the year. If youwant to sink your teeth into a deep and long lasting role playinggame, Dragon Age Inquisition is the game to get."
2014,Dragon Age: Inquisition,"A stunning, must have RPG."
2014,Dragon Age: Inquisition,"With superb writing and rewarding gameplay, Dragon Age: Inquisition offers just about everything that you could want from a genre that's been sorely missed on the PS4."
2014,Dragon Age: Inquisition,"An RPG full of action that will delight players thanks to a lengthy plot and a wide array of possibilities. Even if it shows some technical issues, it's more than just another western RPG adventure."
2014,Dragon Age: Inquisition,"Dragon Age: Inquisition starts off as a good game and keeps getting better as it goes along. This doesn't mean the early parts are insufferable, but instead shows how the game continues to build and develop throughout its entirety."
2014,Dragon Age: Inquisition,"Dragon Age: Inquisition is a graphical showcase for the next-generation consoles¡Xa sprawling, beautiful open-world RPG with a deeply satisfying exploration loop and just enough in the way of mechanical depth to keep hardcore adventurers happy."
2014,Dragon Age: Inquisition,"With a huge, breathtaking world, an epic story, and choices that leaves a significant mark on the world around you, Dragon Age: Inquisition embodies everything that makes the series so popular."
2014,Dragon Age: Inquisition,"If you are looking for a time sink of an RPG with a strong sense of setting and character, then look no further, because Dragon Age: Inquisition is a Game of the Year candidate."
2014,Dragon Age: Inquisition,Dragon Age: Inquisition is a wonderful game and a lengthy pilgrimage to a magical world with vital thematic ties to one we already know.
2014,Dragon Age: Inquisition,"Dragon Age: Inquisition returns the franchise to right path after disappointing second installation. Its massive world combined to leading the ever growing Inquisition makes the game really addictive. Plot could be more coherent, but after 40 hours I still crave to search every inch of the world."
2014,Dragon Age: Inquisition,"Exciting, very detailed in every area, full of brilliant dialogues, characters and things to do including crafting, remote missions, exploration and a very well balanced leveling. Add great visuals and you'll have the best episode of the series so far."
2014,Dragon Age: Inquisition,"It¡¦s a surprisingly huge, dense world, and I soon realized there were still entire sandboxes I hadn¡¦t even set foot in. Even in my hundredth hour, I¡¦m still discovering."
2014,Dragon Age: Inquisition,"Inquisition is a Schrodinger¡¦s Goldilocks kind of a game: too big and just right at the same time...The main campaign is more interested in telling you how great you are than letting you prove it, and combat feels designed for a game half this size. It¡¦s not a far fall from grace, by any means, but it¡¦s noticeable ¡X and occasionally grating ¡X in such a long experience. But if you have been working for the Inquisition for that long, hopefully by then you will be too busy discovering and exploring to care that much."
2014,Dragon Age: Inquisition,"Takes far too long to get going, but once it does you'll be hooked for the longest haul. [Jan 2015, p.64]"
2014,Dragon Age: Inquisition,"The Dragon Age game people who hate Dragon Age will like. [January 2015, p76]"
2014,Dragon Age: Inquisition,"It is not a revolution, but it is one of the best RPGs we've seen in a while. Definitely, the best of its genre on the next generation of consoles."
2014,Dragon Age: Inquisition,"Dragon Age: Inquisition is the biggest and best Dragon Age to date. Packed to the brim with content and carefully refined mechanics, it's sure to please any Dragon Age fan. It has a fair share of problems, but none detract too much from the strong core experience."
2014,Dragon Age: Inquisition,"Inquisition is a triumph and proves that despite some missteps along the way, BioWare hasn't lost its touch."
2014,Dragon Age: Inquisition,"An exhaustive and impactful world let down by predictable aesthetics and combat. [Issue#251, p.70]"
2014,Dragon Age: Inquisition,"A flawed almost-classic. [Jan 2015, p.84]"
2014,Dragon Age: Inquisition,"Once you've dipped into the game's heavily customizable odds and ends, and made decent strides in the core campaign, you'll soon realize just how much there is to do and see in Thedas and its many regions."
2014,Dragon Age: Inquisition,Dragon Age Inquisition is a solid RPG that should conquer any gamer's heart with its well-rounded gameplay. Definitely a big improvement over the last game in the IP.
2014,Dragon Age: Inquisition,"Dragon Age: Inquisition creates a massive, vibrant world on a scale far greater than its predecessors, and does an excellent job of making you feel in command. The heart of this game rests with its characters, who keep you invested in the action."
2014,Dragon Age: Inquisition,"I¡¦ve had a great time leading the Inquisition. It¡¦s unusual to be able to look back at a game like this and have such fine memories, despite being so underwhelmed by its opening hours. For some, it may well feel like too much of a grind to begin with, and for time-poor players those 15 hours may be far too much of an investment."
2014,Dragon Age: Inquisition,"It might be conventional as far as visuals and monsters go, but its overall appeal rests in its provision of a living world that can be sculpted and altered in ways both subtle and explicit. So long as you're prepared to put the required time in, Dragon Age: Inquisition has plenty to give."
2014,Dragon Age: Inquisition,"Inquisition will most likely suffer the same fate as its predecessors. It¡¦s a fun game that will probably never achieve a broad fan base, but there will be those that love the game and will go to great lengths to defend it with rabid aggression. All told, I was expecting more but I¡¦m not really that surprised. I had fun and that¡¦s what counts."
2014,Dragon Age: Inquisition,"Inquisition feels slick but siloed. The story and exploration parts of the game are boxed separately, and the latter is full of prefab errands with few ties to the themes of the Dragon Age setting."
2014,Dragon Age: Inquisition,Lovely design and solid atmosphere but the gameplay feels clunky.
2014,HearthStone,"Between its friendly design and its flexible approach to a free-to-play economy, Hearthstone has successfully pulled me into a genre that I didn't care about in the least. But even more incredibly, it's kept me rapt longer than any games I've played in years, and shows no signs of letting up."
2014,HearthStone,"It's overflowing with character and imagination, feeds off and fuels a vibrant community of players and performers, and it only stands to improve as Blizzard introduces new features, an iPad version and expansions. And now it's finally finished! I can't wait to see where it goes next. Job's done."
2014,HearthStone,"It¡¦s easy to learn, easy to get into matches and play, and it¡¦s fun. It¡¦s led me to check out other digital card games ¡X and I¡¦m again surprised at how much I enjoy these."
2014,HearthStone,"When Blizzard announced they were making a digital CCG, we all expected it to look and sound beautiful, and there was little doubt that it would be well-balanced, but I don¡¦t think anyone anticipated this level of sophistication and subtle brilliance."
2014,HearthStone,"A gem that combines a great PC franchise with simple gameplay and a reasonable Free to Play business model. [June 2014, p.54]"
2014,HearthStone,"Hearthstone, the newest card game from Blizzard, will keep you hooked for hours thanks to the amazing presentation and the tactical, deep gameplay. This is free to play done right."
2014,HearthStone,"With bags of depth to tap into, this deserves to be recognised as one of the genre's finest. [June 2014, p.72]"
2014,HearthStone,"A beautifully designed game, as gratifying and addictive as anything Blizzard has ever done. [June 2014, p.72]"
2014,HearthStone,"It has, through painstaking effort, upgraded the card duel into a thoroughly modern form. It has resisted the dark lures of free-to-play, and has made deep systems simple to parse without neutering them. In short, Hearthstone is borderline alchemy, turning physical systems into digital gold."
2014,HearthStone,"Hearthstone is addictive, highly strategic, and chock-full of fun collectible card battling; the fact that it's totally free (if you want it to be) makes it one of the best values in gaming today. This is your new obsession; embrace it."
2014,HearthStone,"Blizzard's first Free to Play-game offers depth without becoming complex. It takes players seriously and is very playable without spending (a lot of) money. Atmosphere, speed and great sound effects make for fast yet satisfying games, where luck and tactics go hand in hand."
2014,HearthStone,"Hearthstone is thoughtful and complex, but at the same time welcoming and almost irresistible. It may just be a card game, but it often feels like so much more."
2014,HearthStone,"Blizzard's team has done about everything right with Hearthstone. They took tried and tested pieces from other card games, found clever mechanisms to take away their weak spots and other frustrations and offer a strong and addictive free-to-play experience."
2014,HearthStone,"Blizzard has put its imprimatur onto another genre, and it looks poised to succeed in CCGs with Hearthstone as it has with MMOs in World of Warcraft."
2014,HearthStone,"Hearthstone: Heroes of Warcraft is the best digital collectible card game for everyone. Easy to learn and difficult to master. The musical score and sounds are just like the Warcraft Universe. But if you are a Magic: The Gathering player, you definitely won't like it."
2014,HearthStone,"Hearthstone seems a good fit for tablets, and if Blizzard can maintain the quality of the animations, it will become a serious phenomenon."
2014,HearthStone,An amazing classic card game that surprises for its attention to detail and highly addictive gameplay.
2014,HearthStone,"Hearthstone is the best digital collectible card game around and an excellent ¡§real¡¨ game as well, where the formula ¡§easy to learn, difficult to master¡¨ really comes to life."
2014,HearthStone,"Hearthstone: Heroes of Warcraft is an idea as good as Magic: The Gathering was. It's very similar to Magic cards and that's great. Although it's very accessible and visual, perfect for new players and experts. Blizzard has returned to work magic."
2014,HearthStone,"Hearthstone might not fully scratch the strategy itch of the most advanced CCG/TCG players, but it makes an impressive attempt. The rules are simple, so anybody can get the hang of it, but there are enough deck variations available that only skilled deck builders and players will make it high in the ranks."
2014,HearthStone,"Accessible, addictive and fun, Blizzard brings us a very interesting free-to-play, very well balanced game, that everyone interested in the Warcraft universe should try."
2014,HearthStone,"Hearthstone is a wonderful game. Nostalgic, simple and best of all: fun. This is the best online collectible card game you can play. Just be careful how much you spend in it."
2014,HearthStone,"The elegant simplicity of Hearthstone¡¦s rules, its impressive attention to detail and personality, and the true viability of playing completely for free make it easy to fall under its spell and get blissfully lost in the depths of its strategic possibilities."
2014,HearthStone,"If you¡¦ve ever been curious about collectible card games but didn¡¦t know where to begin, Hearthstone is the place to start."
2014,HearthStone,"A simple game if compared to Magic, nonetheless the Blizzard CCG delivers a fair amount of depth for the average player. There is a little shade of pay-to-win, but is perfectly possible to have fun without spending a dime."
2014,HearthStone,"On a more personal level, Hearthstone is solid enough that if it gets its hooks in you, they will dig deep. The game takes on a Civilization-like level of addictiveness where instead of one more turn, you¡¦ll often tell yourself ¡§just one more game¡¨. That one more game can quickly become five, or ten, or more depending on how much time you have to spend and I imagine this is going to only be amplified once the mobile versions of the game come online."
2014,HearthStone,"Simple rules, high production values, low system requirements and huge tactical freedom make Hearthstone one of the best card games available. And if you take into account the free-to-play model ¡V it¡¦s the best one. [05/2014, p.62]"
2014,HearthStone,"A fine example of a great free-to-play game. Hearthstone is not only an addictive and well designed card game, but absolutely fair with gamers that do not wish to spend money on it."
2014,HearthStone,"Hearthstone is a polished, stylish and friendly collectible card game which offers tons of fun and challenge at no cost. It's still not very balanced - and probably will never be - and it lacks a trading system, but Blizzard managed to appeal both newcomers and veterans to the genre."
2014,HearthStone,"Hearthstone is currently the best card game in circulation when you consider its target audience. With easy-to-learn gameplay, this game is still able to provide a lot of satisfaction even to the most experienced players."
2014,HearthStone,"It¡¦s this level of polish and accessibility that Blizzard have infused into Hearthstone that make it a great success, no matter how you feel about card games."
2014,HearthStone,One of the best free-to-play games on the market because you can actually play this one for free and have a good time while doing so. It is easy to learn and fun to master. [Apr 2014]
2014,HearthStone,Hearthstone wants to be a fast paced and entertaining card game for beginners and experts alike - and it achieves this goal with flying colors.
2014,HearthStone,"Video gamers may wonder why they would play a card game when their medium has moved beyond such limitations; tabletop gamers may bemoan the fact that people are getting excited about the wrong card game. But if you fall awkwardly between those two groups, Hearthstone will keep you hooked for some time."
2014,HearthStone,"For now, Hearthstone is very much a triumph, and with a mobile client rolling out there¡¦s a sense that we¡¦re at the beginning of a phenomenon rather than in the midst of one. Yet again, Blizzard seems to have played its cards absolutely right."
2014,HearthStone,"A fast, deep and exciting card game let down by its business model. Great when you're on a roll, rough when you're not. [Apr 2014, p.84]"
2014,HearthStone,"Brilliantly accessible, yet incredibly deep. Blizzard dominates the virtual gaming card genre, but a tournament mode would have made it even better."
2014,HearthStone,"If any developer's good at weeding out the chaff of more robust games in a particular genre, surely it's Blizzard."
2014,HearthStone,This first attempt from Blizzard on the free to play market is a success. You don't have to pay to win in this card game that looks really nice and is as interesting as addictive to play.
2014,HearthStone,"While it may not be as complicated as an actual collectible card game, or have the appeal of showing off your collection to your friends, it is a great videogame that has minimal issues and is in a neat package, so it would be foolish to try to compare it to something it¡¦s not trying to be."
2014,HearthStone,"It's difficult to resist the charms of HearthStone: Heroes of WarCraft, which stacks up qualities. Easily manageable by any gamer, highly addictive, and made with an artistic touch, this game fully uses the rich Warcraft universe and its fame. The price to pay is having to make due with classic card game gameplay, not a revolution in the card collecting game genre...and it can prove tiresome at some point if you don't go hunting for the rare cards. Strangely, the interface needs improvement, and some bugs still persists. But since the game is free and really fun, there is no reason to not give it a try."
2014,HearthStone,"Hearthstone is a well-executed and fun card game, one which lives the ¡§easy to learn, hard to master¡¨ mantra to the utmost."
2014,Middle Earth,"Right now, it¡¦s my main contender for game of the year, simply because, in its lack of pretension, its attention to detail and its understanding that video games first and foremost should be fun, it puts everything else I¡¦ve played recently in its long shadow."
2014,Middle Earth,"Middle-earth: Shadow of Mordor is the most fun I've had with an open-world game in a very long time...Whatever your feelings on J. R. R. Tolkien and the Middle-earth milieu, it's hard to imagine any fan of open-world action having anything less than a great time with this game."
2014,Middle Earth,What would have otherwise been a competent sandbox game with solid combat mechanics and an interesting twist on a known fantasy world is elevated by the Nemesis System. Shadow of Mordor is the strategic person's action game.
2014,Middle Earth,"Shadow of Mordor is without a doubt the best The Lord of the Rings game that I have ever played, and quite probably the best game I've played this year. I highly recommend it to anyone who enjoys a great action game."
2014,Middle Earth,Shadow of Mordor is that ultimate rarity. It tells a fun little story that would be enough to hold up most games on their own. But it also provides all of the tools to ensure that the most interesting tales to come out of the game will be the ones that were not scripted.
2014,Middle Earth,"Middle-earth: Shadow of Mordor stands out from other open-world action games by putting a great new layer on top of the trail that Batman blazed. I was surprised at how well it integrates its excellent combat with rewarding feedback and progression not just for me, but also for my enemies. I"
2014,Middle Earth,"All in all, I really enjoyed Middle-Earth: Shadow of Mordor. While the game had always been on my radar, I still find myself pretty surprised with how fantastic it ended up being."
2014,Middle Earth,"For people who are alright with playing fifteen hours or so of Helm¡¦s Deep-style carnage, Shadow of Mordor is a delight ¡V and even for people who couldn¡¦t care less about Lord of the Rings, the exciting combat and unique Nemesis System are more than enough to make the experience worthwhile."
2014,Middle Earth,As a gamer you owe it to yourself to experience Shadow of Mordor if not for anything else other than the Nemesis system because playing a single-player game never made you feel less alone.
2014,Middle Earth,"A precious package that is both incredibly challenging and rewarding in all the right ways. [December 2014, p70]"
2014,Middle Earth,"While there are a limited number of genuinely memorable landmarks in the world of Mordor, the real points of interest is the captains being hunted."
2014,Middle Earth,Shadow of Mordor is without doubt the best Middle-earth game available on consoles.
2014,Middle Earth,"A stunning title that mixes the best parts of other games, whilst introducing its own ideas."
2014,Middle Earth,"Combining the transversal and exploration of Assassin's Creed and the combat of the Batman: Arkham franchise, Monolith Productions has created not only the best title in the Middle-earth franchise, but probably the best action title of the year."
2014,Middle Earth,"While not perfect, Shadow of Mordor surpasses expectations - it's fun, engaging and truly impressive. The Nemesis System is a stroke of genius and sets this game apart from its competitors. A serious contender for Game of the Year."
