Year,Game,Review
2009,Assassin's Creed 2,"Assassin's Creed II took a formula of a great new IP and made it even better. It really did. everything about this game is great. The huge upgrades from the last game to this one are absolutely tremendous. This game focused more on adding numerous elements to gameplay, while also having one of the best stories and characters of any game I've played. The journey Ezio Auditore goes on toAssassin's Creed II took a formula of a great new IP and made it even better. It really did. everything about this game is great. The huge upgrades from the last game to this one are absolutely tremendous. This game focused more on adding numerous elements to gameplay, while also having one of the best stories and characters of any game I've played. The journey Ezio Auditore goes on to becoming an Assassin is a great example of how to develop a character. Throughout playing the game, you connect with Ezio in his situations, like when his father and brothers are murdered. You begin to care for him and his quest, as with all the other characters. As for Desmond... I never really liked Desmond's side of the story, but this game probably has the best story involving him, mainly because the growth between Desmond and Lucy, and his growth with the other characters, Shaun and Rebecca. The gameplay, like I mentioned, adds tremendously onto the last game, but it doesn't to the extent that it's too overwhelming, like Assassin's Creed III. Each area is big, but not too big, which adds the sense that makes each area confined. And thanks to elements such as buying armor and weapons, the combat system has improved a great amount. The control for the game is much better this time around. Ezio maneuvers much faster than Altair, and it makes the control faster and fluent. The soundtrack is great for this game. every track is beautifully composed, and fits perfectly with each area and scene. Overall, Assassin's Creed II steals the spot for my all-time favorite video game. It's perfectly written, has better control, better gameplay mechanics, more gameplay mechanics, pretty much more and better of everything.\"
2009,Assassin's Creed 2,"Eradicates all of it's predecessor's flaws and adds improved combat mechanics, a loveable protagonist, an engaging story and some enjoyable side missions to produce a game worthy of a game of the year nomination."
2009,Assassin's Creed 2,"This game uses the same formula as the first Assassin's Creed but make drastic improvements. Number 1.) The characters are all done a lot better and there is a lot more depth to Ezio, the character you play as, than you had for Altair. Number 2.) The combat was more refined and less tedious. When you got into fights with guards and such, it was a lot more fun than the first Assassin'sThis game uses the same formula as the first Assassin's Creed but make drastic improvements. Number 1.) The characters are all done a lot better and there is a lot more depth to Ezio, the character you play as, than you had for Altair. Number 2.) The combat was more refined and less tedious. When you got into fights with guards and such, it was a lot more fun than the first Assassin's Creed because it was far more polished and just easier to use. Number 3.) The Campaign is about 10 hours longer and there are a few other mini games you can do to increase its replay value, so with that being said, I have to give it a better score than usual, but my biggest problem with the game is how too polished the combat is. There are a lot of times where you have to take on swarms of guards and it doesn't really feel like Assassin's Creed anymore when you do. I liked the first one because if you got attacked by a swarm of guards, you usually didn't want to stick around. Granted there were a few times where you were forced to fight, it happened rarely and paced the game well. In AC2 there's just so much fighting it doesn't feel like Assassin's Creed anymore. Warrior's Creed maybe, but not Assassin's Creed. It's still a great game, just a bit misguided.\"
2009,Assassin's Creed 2,"Turns out my initial impressions of this game were wrong.  It's true, it does suffer from a bit of miasma early on, but once you get going and get a feel for the controls, it's an engaging feast of action and adventure.  I played it relentlessly to the end, and while the finale could have been better, this is still a very solid game."
2009,Assassin's Creed 2,"assasins creed 2 improves on absolutely everything from the lastpros: combat improvement, better story, better characters, desmond was more involved and useful here, ezio is even cooler then altair, a more interesting setting, better side activitiescons: I kind of miss altair sometimes"
2009,Assassin's Creed 2,"amazing.  the story, setting, characters, gameplay, plot, pacing, visuals, and u all great.  my only issues are that there isn't that much replay value, and sometimes the game got boring."
2009,Assassin's Creed 2,One of my favorite games of all time it had a beautiful story great character development and so much replay value it is the best xbox360 or ps3 game money can buy it won more awards than l4d because l4d has no innovation.
2009,Assassin's Creed 2,"I'll start by stating that this game has some fun moments, and has a lot to explore which makes it fun at times but soon after playing a little while; it gets repetitious and a little boring. I did not like the main character as I didn't like his irresponsible and womanizing attitude, so it was hard for me to care about the story at all.The AC series as a whole os overrated and justI'll start by stating that this game has some fun moments, and has a lot to explore which makes it fun at times but soon after playing a little while; it gets repetitious and a little boring. I did not like the main character as I didn't like his irresponsible and womanizing attitude, so it was hard for me to care about the story at all.The AC series as a whole os overrated and just meh at times...\"
2009,Assassin's Creed 2,"Many things in Assassin's Creed II are great, but there are also aspects of the game that aren't really that good.In Assassin's Creed II you play as a young man named Ezio Auditore da Firenze whom lives in Florence with his family of bankers. After seeing his father and brothers being executed, he decides to follow in his fathers footsteps, the way of the assassin. And believe me, there's more to this story that meats the eye.The gameplay of Assassin's Creed II is pretty simple and easy to learn. The four face buttons does one thing each. The X button sorts out different attack manoeuvres. The A button lets you run, jump and do other kinds of acrobatics. The B button will make you grab and interact with the world around you. And lastly, the Y button turns on your Eagle Vision, the sixth sense of the assassins. But while the gameplay is easy to learn it's not fun or easy to maneuver.Then there is the graphics whom sometimes are colourful and sometimes as grey and dull as the said ""colour"".And last, but not least, is the music composed by Jesper Kyd. And while the score is good it's not great. This is because all the songs in Assassin's Creed II sound the same, something that makes you really tired of hearing the same track over, and over again.So, in the end, Assassin's Creed II is a pretty good game, with a pretty good story, good gameplay and so-so graphics and music. And my final score is a 7 out of 10.\"
2009,Assassin's Creed 2,"Absolutely amazing. The graphics are breathtaking, the characters are all likable the atmosphere is great and has a unique feel to it that I can't explain. The story is very good as well probably my favorite in the series. The gameplay changes a lot and it stops it from getting repetitive. There's assassinations, stealth, combat and many others. The only thing that stops it from getting aAbsolutely amazing. The graphics are breathtaking, the characters are all likable the atmosphere is great and has a unique feel to it that I can't explain. The story is very good as well probably my favorite in the series. The gameplay changes a lot and it stops it from getting repetitive. There's assassinations, stealth, combat and many others. The only thing that stops it from getting a 10 is that the combat can get very annoying when fighting brutes and spear men but I still strongly recommend this game.\"
2009,Assassin's Creed 2,"in comparation with the first assassin's creed this game is much better in all aspects,it has a great story and an great world but the problem is that don't have so much secondary missions."
2009,Assassin's Creed 2,10/10awesomeawesomeawesomeawesomeawesomeawesomeawesomeawesomeawesomeawesomeawesomeawesomeawesomeawesomeawesomeawesomeawesomeawesomeawesomeawesomeawesome
2009,Assassin's Creed 2,"It is a great game in my opinion the best storyline of a game yet.Ubisoft did a great job the story,characters and sound track  is awseome an assassins creed game can never be good as this A 9999999999999999999999999999 review\"
2009,Assassin's Creed 2,"For me this is the peak of the series, this game feels like a proper sequel to the original, building off what was good about the first game and improving what was good while taking out what was done poorly in the series debut. I also think this was the last Assassin's Creed game that's ambition was beyond making money as the Hitman aspects of the gameplay seem to get forgotten about afterFor me this is the peak of the series, this game feels like a proper sequel to the original, building off what was good about the first game and improving what was good while taking out what was done poorly in the series debut. I also think this was the last Assassin's Creed game that's ambition was beyond making money as the Hitman aspects of the gameplay seem to get forgotten about after this instalment. Getting back to this game the maps are fantastic and huge, the story is good but not great, this game seems to be the start of the series being present at important events in history just for the sake of being there, I mean I don't see Da Vinci's presence being that important to the overall story, he seems to be there just so the writers can show off some pretentiousness as apposed to actually writing some good fiction with original characters. However the game does do a good job at showing how corruptness is part and parcel of religion and high society throughout history. The game mechanics haven't changed a lot, every thing has being improved in terms of movement, flow and combat. There is plenty of climbing to be done which is fun but the amount of good stealthy killings seems to have gone down slightly with the main storyline assassinations being more focused on action set pieces and the Hitman style plan, wait, pounce method seems to have been assigned to the side missions. Overall this is a must own title of this generation and if your only going to play one Assassin's Creed game then make it this one.\"
2009,Assassin's Creed 2,"It's just simply one of the best games ever made! I never got around to giving it a review, so I'll do it now. This game has an amazing story with gameplay that will leave you absolutely hooked. It still looks stunning 4 years later. Honestly I have no clue how they made this game look so good on 360/PS3. 10/10, one of the best games ever"
2009,Assassin's Creed 2,"After playing this game after I played ""Assassin's Creed III"", I found myself disliking III more and more. This game has and insane scope to it, and not a moment is left dull. The story will keep you hooked for the entire journey. And I am proud to say that this is one of my favorite games of all time.I definitely recommend this game to any gamer who has not yet had the joy ofAfter playing this game after I played ""Assassin's Creed III"", I found myself disliking III more and more. This game has and insane scope to it, and not a moment is left dull. The story will keep you hooked for the entire journey. And I am proud to say that this is one of my favorite games of all time.I definitely recommend this game to any gamer who has not yet had the joy of experiencing this master peace.\"
2009,Assassin's Creed 2,"Assassin's Greed  2 is an awesome game. The storyline is beatifull and very long. The voiceacting and graphics are decent. What I dont like about this game is whenever you kill a ""boss"", a new one pops up. Why cant you show me all the bosses at the same time? This tactic a cheap way of introducing more bosses into the game, but I do love the boss fights and character development in thisAssassin's Greed  2 is an awesome game. The storyline is beatifull and very long. The voiceacting and graphics are decent. What I dont like about this game is whenever you kill a ""boss"", a new one pops up. Why cant you show me all the bosses at the same time? This tactic a cheap way of introducing more bosses into the game, but I do love the boss fights and character development in this game. It might be the best Assassin's Greed game to date.\"
2009,Assassin's Creed 2,"This game started the Assassin's Creed that we have come to love, excellent story, great gameplay, good replayability and all around better than the bad of poop that is AC1"
2009,Assassin's Creed 2,"If I could, I would give this game a 9.5/10. Assassin's Creed 2 is easily the best game of the entire series, it took everything that was amazing about the first Assassin's Creed (Which was quite average) and made it even better.Assassin's Creed 2 focuses on Ezio Auditore, an assassin that had his father and two brothers wrongly accused of treason and hanged. After seeing them die inIf I could, I would give this game a 9.5/10. Assassin's Creed 2 is easily the best game of the entire series, it took everything that was amazing about the first Assassin's Creed (Which was quite average) and made it even better.Assassin's Creed 2 focuses on Ezio Auditore, an assassin that had his father and two brothers wrongly accused of treason and hanged. After seeing them die in front of him, Ezio becomes filled with rage and goes on a long journey to take revenge on the De Pazzi family, who already didn't like the Auditore family.The storyline to this game is truly amazing, Ezio is very likable and the best assassin in my opinion, it has great side activities. The combat, just like every game excluding Unity is too easy. It looks cool but it doesn't give me a sense of accomplishment that games with hard combat do.If you like video games, play Assassin's Creed 2 and you will not be let down as it is a great game that all video game fans should play, even if they don't like the Assassin's Creed series.\"
2009,Assassin's Creed 2,"Talk about a surprise! While I bought it just so I could see what happened in the story I was shocked that it was actually a fun game. They improved every single thing from the first game, and even though it's still repetitive it was Fun. Ezio has more charisma and personality than Altair had, and that makes a big difference. You have a protagonist who you care for and you want him to getTalk about a surprise! While I bought it just so I could see what happened in the story I was shocked that it was actually a fun game. They improved every single thing from the first game, and even though it's still repetitive it was Fun. Ezio has more charisma and personality than Altair had, and that makes a big difference. You have a protagonist who you care for and you want him to get his revenge.Then the story is awesome again, great sidequests and treasure hunting, all the upgrades you can do to the Villa, it just keeps you hooked.\"
2009,Assassin's Creed 2,This very Assassin's Creed game has made me a big fan of the franchise. This game has one of the greatest story lines for a video game ever created. The gameplay is fantastic and fast paced and one of the few games out there which actually makes you have to use skill to defeat your foes. This game is a must-own for any Assassin's Creed fan (but I bet they may have already bought the game)This very Assassin's Creed game has made me a big fan of the franchise. This game has one of the greatest story lines for a video game ever created. The gameplay is fantastic and fast paced and one of the few games out there which actually makes you have to use skill to defeat your foes. This game is a must-own for any Assassin's Creed fan (but I bet they may have already bought the game) or anyone who is new to the franchise. Buy this game.\
2009,Assassin's Creed 2,"This sequel basically took everything from the first, and made it better.The plot is much more deep and emotional, as you instantly become attached to the protagonist, Ezio. From start to finish the game makes you care, which is very important. The modern day side is also progressed.The gameplay is much more expanded, and this time all the repetition is gone. This makes the actionThis sequel basically took everything from the first, and made it better.The plot is much more deep and emotional, as you instantly become attached to the protagonist, Ezio. From start to finish the game makes you care, which is very important. The modern day side is also progressed.The gameplay is much more expanded, and this time all the repetition is gone. This makes the action much more entertaining and fun.The environments are good. Graphically superb like all the other games in the series.Honestly one of, if not the best adventure games out there. Rarely does a game with so much ambition and scope connect on so many levels.\"
2009,Assassin's Creed 2,"I can see why some people gave this game a 10/10. If I would have played it at launch, I might have given  it a 9/10 myself. It was a real step up from the first game (not that I've played the first game as of this review). You'll play as Ezio Auditore as you assassinate targets, buy rennovations, etc. in multiple beautiful Italian locations. It works well but I'm afraid I must say it'sI can see why some people gave this game a 10/10. If I would have played it at launch, I might have given  it a 9/10 myself. It was a real step up from the first game (not that I've played the first game as of this review). You'll play as Ezio Auditore as you assassinate targets, buy rennovations, etc. in multiple beautiful Italian locations. It works well but I'm afraid I must say it's not the best Assassin's Creed. There, the forbidden words have been spoken! It's still a great game, though (even today).\"
2009,Assassin's Creed 2,"A MASTERPIECE. There's not any other game that combines plot, playability, innovation and graphics like ACII. And what can I say about the soundtrack? Nothing is true. Everything is permitted."
2009,Assassin's Creed 2,"I love this game. It improves in every aspect over the first game with much better character development and storyline. AC2 offers a variety of new tools, weapons and techniques to dispatch targets in a variety of ways. The development team really hit the nail on the head this time around.\"
2009,Batman Arkham Asylum,awesomeness in a X360 box. great that they used the voices from the cartoon show and the joker being mark hamill. the game was awesome. enjoyed tha combat and it is not hard to execute combos. i like the upgrades to the equipment over time allowing new take downs and areas to be unlocked etc.
2009,Batman Arkham Asylum,"Batman: Arkham Asylum is an amazing, immersive game that even borders on groundbreaking at times, yet still manages to be let down somewhat by lack of polish in a few key areas. It was the best game i had played in a long time, yet i couldn't help feeling that had as much love been given to basic matters like controls, AI, and boss design as were paid to faithfully creating what it's likeBatman: Arkham Asylum is an amazing, immersive game that even borders on groundbreaking at times, yet still manages to be let down somewhat by lack of polish in a few key areas. It was the best game i had played in a long time, yet i couldn't help feeling that had as much love been given to basic matters like controls, AI, and boss design as were paid to faithfully creating what it's like to BE batman, the game, while definitely a must buy for any action game fan, could have been truly genre-defining.The good:Combat mechanics are deceptively deep and offer pick-up-and-play simplicity while having a lot more to offer for those who want to polish their skills a little more. Once mastered, combat is quick and intuitive, and there is a real sense of achievement and enjoyment to be had out of gliding toward a bunch of enemies, KO'ing one of them with a glide kick, landing, and proceeding to beat the daylights out of several others, using counters and various special move options to chain together long combos. One partiularly gratifying battle towards the end of the game allows you to go hand to hand with 15+ of the joker's henchmen in a locked room that's barely big enough to swing a cat, but if you've mastered the combat system, you can use batman's phenomenal martial arts skills to drop each and every one of the group over a several minutes long scrap, before continuing onwards towards their boss.The Joker, voiced by star-wars actor Mark Hamill, is phenomenal throughout the game, even when not onscreen and making his presence felt through loudspeaker announcements over the asylum's ever present tannoi system. In contrast to batman's stoic, focused persona, his crazy, maniacal, and sometimes downright funny dialogue steals the show at every turn.The game's replay value is excellent. Even when you've completed the main story, there are still loads of collectables, trophies, challenges, and one or two very cool secrets and side quests to uncover. Getting to 100% on this game really will take a LONG time.The bad:Number one on this section has to go to the controls. While they're fine when batman has a bit of space, controls in close combat can be a bit clumsy, resulting in Batman taking an occasional lead pipe over the back of the head, which is never nice, or particularly in one of the games many stealth sections where batman has to creep around an area, covertly taking out armed enemies. Just occasionally, you'll need batman to creep up behind an enemy, kick his legs out from under him, grab him around the neck and choke him out silently before disappearing off into the shadows again, but the game will interpret your control commands as ""do a random parry move, then do it again, then kick him in the back and warn him and his buddies that you're there allowing them to blast you into pieces"". This can be frustrating at times, but nowhere more so than the game's stealth challenge modes, where the idea is to take out an entire room of armed enemies using stealth tactics and batman's arsenal of tricks and gadgets, in the shortest time possible. In these challenges, every second counts, and it's maddening to know exactly what you want to do, be in a hurry, and have the game do something completely different and blow your cover. Add to this the Xbox's lacklustre analogue d-pad that's used to select one of up to 8 gadgets to help you out when you're in a pinch, and batman thus getting the wrong gizmo out in a crisis, and you have a control system that's not as well designed as it could have been for what you need to do in-game. It's not  monumentally flawed, and it works well for the most part, as long as you're not in a hurry, but it's definitely something the upcoming ""Batman Arkham City"" sequel needs to address.The Boss fights are bland and generic affairs that don't really fit in with the overall tone of the game, and are boring and repetitive in parts. Bane, Killer Croc, and in particular Poison Ivy all were either boringly repetitive on normal, or maddeningly cheap and frustrating on higher difficulties. More thought should have been given to overall boss design in this game, as they all feel pretty much tacked on to the overall story.Scarecrow. While the addition of scarecrow's platforming levels throughout the course of the game were an interesting twist on the gameplay, i couldn't help feeling that they didn't fit, and just served as an unwelcome distraction from the rest of the action of the game. Overall, despite a handful of faults, this game is still well worth a purchase for any action game fan, and is simply a ""must buy"" for any Batman or comic book fans in general. More stealth challenges, more polish on the combat and close quarters controls, better boss fights, and slightly less robotic AI would have made this an all time classic, but as it is, it's still well worth picking up. Score 90%.\"
2009,Batman Arkham Asylum,"Game of the year 2010. There is nothing bad i can say about Batman: AA. The combat is fluid and fun, and has great impact, The story is a classic batman plot, that doesn't take too much attention from the game itself, and the game ends exactly when it should, with a solid 30 hour clock for a thorough play through. Presentation wise, the voice acting is simply stunning, and the visualsGame of the year 2010. There is nothing bad i can say about Batman: AA. The combat is fluid and fun, and has great impact, The story is a classic batman plot, that doesn't take too much attention from the game itself, and the game ends exactly when it should, with a solid 30 hour clock for a thorough play through. Presentation wise, the voice acting is simply stunning, and the visuals match the asylum perfectly, being both creepy and comical.\"
2009,Batman Arkham Asylum,"Best game of all time, stealth, combat, amazing voice acting. Everything you want in a game. This game was wall to wall entertainment, and worth every penny."
