Year,Game,Review
2009,Uncharted 2,"Rarely does a game so magnificent and spellbinding come along that when Sony released this I went out and bought a ps3.  I was mesmerized by it.  the slick graphics.  The excellent and compelling story.  The oh so satisfying gameplay that has remarkable pacing.  What's not to love about this game???  Recently I have bought games only with replayabillity in them, and yes while this gameRarely does a game so magnificent and spellbinding come along that when Sony released this I went out and bought a ps3.  I was mesmerized by it.  the slick graphics.  The excellent and compelling story.  The oh so satisfying gameplay that has remarkable pacing.  What's not to love about this game???  Recently I have bought games only with replayabillity in them, and yes while this game holds little replay value it still is a wonderful gaming experience that I did not mind spending money on even for it's linear-ness.  This game speaks volumes for itself.  If you own a playstation 3 then you are doing yourself a disservice by not playing this game.  Enjoy!\"
2009,Uncharted 2,"Uncharted 2: Among Thieves is in the top 3 of the best games of all time. It is a masterpiece combined with ridiculously good graphics, great characters, a villain scary and unpredictable. A fantastic story, with moments taken from the blockbuster movie, simple combat, summarized to three buttons, but effective. The game has a multiplayer fun and worth playing. The game, at least the timesUncharted 2: Among Thieves is in the top 3 of the best games of all time. It is a masterpiece combined with ridiculously good graphics, great characters, a villain scary and unpredictable. A fantastic story, with moments taken from the blockbuster movie, simple combat, summarized to three buttons, but effective. The game has a multiplayer fun and worth playing. The game, at least the times I played had no bug, and it runs perfectly well. The voice acting is amazing, good puzzles, and the shotting has no problem at all. Arguably the best game in the PS3, and one of the best of all time.\"
2009,Uncharted 2,"Uncharted 2: Among Thieves is in the top 3 of the best games of all time. It is a masterpiece combined with ridiculously good graphics, great characters, a villain scary and unpredictable. A fantastic story, with moments taken from a blockbuster movie, simple combat, summarized to three buttons, but effective. The game has a multiplayer fun and worth playing. The game, at least the times IUncharted 2: Among Thieves is in the top 3 of the best games of all time. It is a masterpiece combined with ridiculously good graphics, great characters, a villain scary and unpredictable. A fantastic story, with moments taken from a blockbuster movie, simple combat, summarized to three buttons, but effective. The game has a multiplayer fun and worth playing. The game, at least the times I played had no bug, and it runs perfectly well. The voice acting is amazing, good puzzles, and the shotting has no problem at all. Arguably the best game in the PS3, and one of the best of all time.\"
2009,Uncharted 2,"This is one of the best and my favorite ps3 exclusives, not only from ps3 but one of the best playstation exclusives. I love everything, the story, the dialog and the jokes the characters make, the gameplay and the bonus. For 2009 this game has much more quality than other games that came this year. Sure it isn't perfect, during the game i noticed that when i tried to pick a weapon thatThis is one of the best and my favorite ps3 exclusives, not only from ps3 but one of the best playstation exclusives. I love everything, the story, the dialog and the jokes the characters make, the gameplay and the bonus. For 2009 this game has much more quality than other games that came this year. Sure it isn't perfect, during the game i noticed that when i tried to pick a weapon that was above another weapon it was hard and confusing and the video quality was a little strange but with the big load of bonus stuff it's impossible to deny that this is one of the best adventure/ shooter of this generation and i didn't expected less from Naughty Dog and Sony.\"
2009,Uncharted 2,"This game fixed the problems with the first one. the mechanics and puzzles are better, there's a wider variety of guns and the overall experience is more complete. Also, the difficulty has been taken down a little bit (comparing the hardest difficulty settings from both games). The multiplayer works really nice and is actually a lot of fun. the only criticizable thing about this game isThis game fixed the problems with the first one. the mechanics and puzzles are better, there's a wider variety of guns and the overall experience is more complete. Also, the difficulty has been taken down a little bit (comparing the hardest difficulty settings from both games). The multiplayer works really nice and is actually a lot of fun. the only criticizable thing about this game is the story. it makes sense and its well presented, but it is shallow like any action film.\"
2009,Uncharted 2,"Even after playing Uncharted 3 and The Last of Us, Uncharted 2 is stil the best game by Naughtydog and it is still my favorite game. Tons of gameplay, massive amount of gun fights, fun platforming, funny characters, interesting story, a clever script, flawless voice acting, fun multiplayer, excellent soundtrack and amazing graphics. This game has it all for me, and it feels like a movieEven after playing Uncharted 3 and The Last of Us, Uncharted 2 is stil the best game by Naughtydog and it is still my favorite game. Tons of gameplay, massive amount of gun fights, fun platforming, funny characters, interesting story, a clever script, flawless voice acting, fun multiplayer, excellent soundtrack and amazing graphics. This game has it all for me, and it feels like a movie without being weighed down with constant use of interactive cutscenes like Heavy Rain.\"
2009,Uncharted 2,"Uncharted 2 is without a doubt the best game that I have played on the PS3. The single player campaign is absolutely brilliant from start to finish and immediately grabs you from its brilliant opening sequence to the end credits. The game feels very much like a great adventure movie with likeable characters who try to survive various hectic situations in beautiful parts of the world.Uncharted 2 is without a doubt the best game that I have played on the PS3. The single player campaign is absolutely brilliant from start to finish and immediately grabs you from its brilliant opening sequence to the end credits. The game feels very much like a great adventure movie with likeable characters who try to survive various hectic situations in beautiful parts of the world. Everything about this game screams quality. Gorgeous graphics, convincing voiceover, and great, although not revolutionary, gameplay. Uncharted 2 will stun you and make you want to play it non-stop until the credits roll. For me this second part was even more memorable than its predecessor, which is also a brilliant game. This game alone is worth buying a PS3!\"
2009,Uncharted 2,"I never played the first one, but I thought this game was worth a try and it was.I enjoyed almost all of it except the darn  puzzles, hopefully though they will consider continuing this on the ps4. It can be very difficult sometimes even on easy.   This is a   [Must buy]"
2009,Uncharted 2,"Naughty Dog is my favourite as well as Uncharted 2. This game is just perfect to me. I got to say something to someone who doesn't know if buy this or Uncharted 3: Buy this one, because i think you will like better the FIRST of these two you play. I mean, if you play Uncharted 2 and then Uncharted 3, you will prefer U2.This is the best game of this gen, along side with The Last Of Us and GTA V."
2009,Uncharted 2,"My favorite game of all time. Uncharted  2 Among Thieves is not only the GOTY but is a reminder of what Action Adventure games should be.Uncharted 2 has a superb story and it never leaves you astray to what the goals really are. All of the main characters are returning from the previous game and a quite a few new characters and of course a new antagonist. The game uses new and betterMy favorite game of all time. Uncharted  2 Among Thieves is not only the GOTY but is a reminder of what Action Adventure games should be.Uncharted 2 has a superb story and it never leaves you astray to what the goals really are. All of the main characters are returning from the previous game and a quite a few new characters and of course a new antagonist. The game uses new and better reasons for the previous characters for returning in this game, and you never really get too little of any of them. Nor do they ever get annoying.Gameplay is more snappy and less limited to Uncharted Drakes fortune where you couldn't do much except run, jump and shoot.  But they added more guns and better cover mechanics with a constant framerate. they have also added a minor stealth mechanic that lets you go through enemies stealthily. The action never lets up for too long in this game and it keeps you at the edge of your seat from beginning to end.Graphics are some of the best consoles have to offer. With explosions and train wrecks keeping a constant framerate. Facial animations are the best I have ever seen. Also new environments such as a Jungle, a war riddled city in Nepal, and snowy mountains.  The graphics keep these environments feeling alive.I didn't really go too deep in to the game on this review, if i did i would exceed the 5000 character limit. I didn't even mention anything about the addictive multiplayer or the snow effects and touching moments this game has to offer. Just know that this game literally CANNOT get ANY better.BUY THIS GAME AND PLAY IT 7 TIMES!!!\"
2009,Uncharted 2,"Tis is the best possible PS3 exclusive that you can possibly get your hands on. The campaign excels better than the first a more creative plot and many twists. The graphics would no doubt be the best graphics of any game on any system in 2009. Naughty Dog is best at using those-sharp edge graphics. From jungle to snow mountain, scenery is beautiful and the story is compelling. TheTis is the best possible PS3 exclusive that you can possibly get your hands on. The campaign excels better than the first a more creative plot and many twists. The graphics would no doubt be the best graphics of any game on any system in 2009. Naughty Dog is best at using those-sharp edge graphics. From jungle to snow mountain, scenery is beautiful and the story is compelling. The multiplayer offered a wide range of games and offers a different type of play. There are also Co-op 3 person survival that tags along with different game modes. Uncharted 2 is a grand success for Naughty Dog, and is a genuine outstanding game. U2 is currently the ninth best-ranked game of all time on game-rankings (I'm pretty sure) and for me is no doubt one of the top 5 best games this generation. This game has been called a ""masterpiece"" because it is and will no doubly be called that for generations to come.\"
2009,Uncharted 2,"This game is the best game you can ever play! The story is so amazing and interesting there is really noting else like this. I was a fan since game 1 but Uncharted 2 is great! At the end you will fall in love with the series, characters, and story. Its been a few years since this game came out and the graphics are still some of the best I seen. Online play at its time was amazing and isThis game is the best game you can ever play! The story is so amazing and interesting there is really noting else like this. I was a fan since game 1 but Uncharted 2 is great! At the end you will fall in love with the series, characters, and story. Its been a few years since this game came out and the graphics are still some of the best I seen. Online play at its time was amazing and is great on your own or with friends. This is one of those rare games that don't come so often and never gets old from unlocking skins and special in game content for story mode to an epic story mode with great voice over you can't go wrong with buying this game. Uncharted 2 Among Thieves is a great experiences for any gamer out there!\"
2009,Uncharted 2,"The graphics, gameplay, story are all top notch. This is not only one of the greatest games on the PS3, it's one of the greatest in all of gaming history."
2009,Uncharted 2,"One of the best game of ps3, the history is amazing with a lot of intense moments (but a history a little below than uncharted 2) , the characters are unforgettable, perfect gameplay, and much acction where we were never bored. The best graphics for ps3. If you have a PS3, you must have this game."
2009,Uncharted 2,"If Drake's Fortune was the setup, this game is the payoff.  Uncharted 2 is a masterpiece in every aspect.  The writing and performances are smart and snapy, the graphics are amazing, and the story is much more compelling than the first installment."
2009,Uncharted 2,"I'll get this out of the way right now: Uncharted 2: Among Thieves is the game that made me want to persue video game journalisim. In other words, its one of my favorite games of all time. PERIOD. I could justify why I think so, but I think you guys already know. But f**k it i'll talk.The game starts of with a cliffhanger. Literatly. The protagonist Nathan Drake is broken and beaten,I'll get this out of the way right now: Uncharted 2: Among Thieves is the game that made me want to persue video game journalisim. In other words, its one of my favorite games of all time. PERIOD. I could justify why I think so, but I think you guys already know. But f**k it i'll talk.The game starts of with a cliffhanger. Literatly. The protagonist Nathan Drake is broken and beaten, on the verge of death while inside a train hanging of a cliff by a thread. The 5 minute intro is as exlierating as the entire game, and boy did it get my blood pumping. Drake teams up with a couple of his old buddies to look for Marco Polos lost treasure. And with that, the epic game takes off.The story never dissapoints and the acting is top notch. Nolan North takes his role as Nathan Drake again, and shows off some of the best acting i've seen from a game. The chemistry with the rest of the cast is charming and heart warming, and uncomfortable when it needs to be.When it comes to the graphics, Uncharted yet again, is the best. Perfectly polished enviorments breathing with life (or lack there of). Colours are vibrant and pop out and the character animations are almost life like. With some great sound design and what may have the best modern theme song in a video game, Uncharted 2 is absouletley perfect in its presentaion.The gameplay is very simple, however it is never repetitive and always surprising. Theres 3 main gameplay components the work together nicley: Combat, climbing and puzzle solving. Combat is basically a third person cover system where you simply run around and shoot enemies attempting to beat you to the treasure. Theres also a hand to hand combat system, that works much better then it did in its predecessor. Theres nothing ultimatley wrong with the combat, in fact the simplicity of it benfits the game, focusing on the action more then strategy.Climbing and traversing is very easy and satisfying: especially when climbing the tallest of buildings if foreign countries. The puzzles in the game, although there are fewer then there were in the previous games, there much larger in scale and much more epic. I was never really stumped enough to the point of frustration, but they do provide a nice distraction from the usual run and gun.I could go on for hours talking about how perfect Uncharted 2 is, but ill just say this. Uncharted 2 is perfect. SURPRISE. I may be a fan boy, but even after a formal evalutation theres simply no arguing that this, not only helped shape the generation of the PS3 and the future that is yet to come, but it simply is a fantastic expierence, and most definatley The Bathroom Gamers GOTY of 2009.\"
2009,Uncharted 2,This is THE best game ever. The whole gaming experience while playing this is simply amazing. Great combats. Awesome melee attacks. Option of using stealth in some situations. Superb graphics. Witty dialogues. Amazing acting. The superlatives are endless. I haven't played Uncharted 3 yet. But I am not sure how Naughty Dog could possible top 'Among Thieves'. This is the best game for allThis is THE best game ever. The whole gaming experience while playing this is simply amazing. Great combats. Awesome melee attacks. Option of using stealth in some situations. Superb graphics. Witty dialogues. Amazing acting. The superlatives are endless. I haven't played Uncharted 3 yet. But I am not sure how Naughty Dog could possible top 'Among Thieves'. This is the best game for all action-adventure/third-person-shooter fans.\
2009,Assassin's Creed 2,"I love this game. It improves in every aspect over the first game with much better character development and storyline. AC2 offers a variety of new tools, weapons and techniques to dispatch targets in a variety of ways. The development team really hit the nail on the head this time around."
2009,Assassin's Creed 2,"Wow, what a great game. I have almost completed everything and am looking forward to Brotherhood. Hope that is good to, so whatever you do, do not listen to people saying this game sucks, because this game is by far one of the best out there for graphics, action and overall fun."
2009,Assassin's Creed 2,"This game is truly excellent. The story, the visuals, the gameplay, and it is just so much fun. I love all of the missions. None of them are repetitive like the first game suffered from. I just don't have much to say about his game besides the fact that the graphics look a little worse than the 1st game for some reason but this really is not very noticeable. Overall, the game is great, notThis game is truly excellent. The story, the visuals, the gameplay, and it is just so much fun. I love all of the missions. None of them are repetitive like the first game suffered from. I just don't have much to say about his game besides the fact that the graphics look a little worse than the 1st game for some reason but this really is not very noticeable. Overall, the game is great, not much bad to say about it.\"
2009,Assassin's Creed 2,"Another game which took me by surprise, it has a long singleplayer which is strong and engaging to the end, there are enough variations in the gameplay to keep you entertained. The actual maps are brilliant and big enough to keep you exploring around for many hours. The slightly tedious and not very fluent parts are the combats, where they are not as smooth and great as depicted. Where youAnother game which took me by surprise, it has a long singleplayer which is strong and engaging to the end, there are enough variations in the gameplay to keep you entertained. The actual maps are brilliant and big enough to keep you exploring around for many hours. The slightly tedious and not very fluent parts are the combats, where they are not as smooth and great as depicted. Where you see Ezio mowing through guards with ease is more like Ezio getting surrounded by many guards, all of which parry constantly unless a single enemy randomly takes a stab at you, where all your character can do is parry back and randomly counter hoping you take the guy down in retaliation. With that said though, its still thoroughly enjoyable and Brotherhood is going to feature a more fluent combat system and even a multiplayer which they can use and improve in the future. Well Done Ubisoft Montreal!\"
2009,Assassin's Creed 2,"I really wish that I could give this game a 10, but I can't.  The core gameplay of Assassin's Creed II is excellent and really engrossing.  Playing through the main story will give you many fun of hours of fighting, killing, looting, and exploring.  It took me a while to get used to the combat system; once I did, however, the game really opened up for me.  The voice acting was top-notch,I really wish that I could give this game a 10, but I can't.  The core gameplay of Assassin's Creed II is excellent and really engrossing.  Playing through the main story will give you many fun of hours of fighting, killing, looting, and exploring.  It took me a while to get used to the combat system; once I did, however, the game really opened up for me.  The voice acting was top-notch, and the graphics were simply amazing.There are problems - many little problems.  My chief complaint is that once you get decent at combat you will destroy your opponents.  This game would do well to have boss fights that are really challenging.  Secondarily, the pacing of the game is off.  The plot felt fast and rushed in the end, which disappointed me after it was going along so well for most of the game.  Lastly, you make way too much money way too easily by investing in the villa.  Do these flaws ruin the game?  No.  If Brotherhood fixes these issues, however, it will be one of the best games ever made.\"
2009,Assassin's Creed 2,"First up,Assassin's Creed gameplay was simply boring repetitive & to make it worst,there wasn't any anti-aliasing for the ATI graphic card users.Assassin's Creed 2 brought in those changes.I was really pull in by this game due to a few reasons.1:The Background (which takes place Italy), 2:The storyline & plots, 3:Ezio's Costume.For the background,I was amazed by the beautiful highlyFirst up,Assassin's Creed gameplay was simply boring repetitive & to make it worst,there wasn't any anti-aliasing for the ATI graphic card users.Assassin's Creed 2 brought in those changes.I was really pull in by this game due to a few reasons.1:The Background (which takes place Italy), 2:The storyline & plots, 3:Ezio's Costume.For the background,I was amazed by the beautiful highly detailed environments,architectural buildings & historical paintings in Italy during the Renaissance period. What makes the gameplay so addictive was due to it's plots that immerse along with the storyline,leaving players on wanting to know what is gonna happen after each sequence.Relating to the storyline,I think a story about family & revenge is captivating as long there are plenty of conspiracy to unravel the truth.Furthermore,Ezio's noble assassin costume was well designed as it's does blends in with the time line.Although like what most agreed that Assassin's Creed is repetitive in terms of gamplay,I have to be honest that it's also the same for the 2nd installment,except it's repetitive in an addictive way.For those who are concerned about soundtrack,all I can it's decent and suitable with each scenario.I also like the varieties of weapons usage eg.smoke bombs/poison blade as well as different ways & means to distract guards using prostitutes/thieves.Mini games in between such as collecting secrets,artifacts & upgrading the villa is something to keep players occupied even if he/she has finish the main game.Overall,I think Ubisoft Montreal has a really good job on Assassin's Creed 2 not in terms of improving the repetitive gameplay but the beautiful surroundings,game atmosphere,intense plots & also repetitive but addictive gameplay.Luckily,for ATI graphic card users we can finally enable Anti-Aliasing in this 2nd installments. One thing is for sure,Assassin's Creed 2 is definitely worth trying cause it's not gonna leave you with the same experience like you had in Assassin's Creed.The reason on why I can't give a perfect 10 for this game is because there some minor flaws which I believe the developers can improved in the next series of Assassin's Creed.\"
2009,Assassin's Creed 2,This game is awesome. It is the best game of 2009 alongside Uncharted and Arkam Asylum. Ubisoft have improved upon everything that was bad about the first game!!!
2009,Assassin's Creed 2,"This is the best game I have played on the current generation systems, hands down. The story kept me going, the side quests were awesome, and the main story itself blew me away. I can't say enough great things about this perfect game, so I'm going to stop here."
2009,Assassin's Creed 2,"I felt like the game had okay graphics, not enough of a free fight like bman arkham city, glitches left and right, it also bugged me that when enemies died, they did a body jump, they like twitched or something, but still, its fun for how sneaky you can be, the details are spot on, and the more detailed costumes made it worth its price\"
2009,Assassin's Creed 2,"Assassin's Creed 1 was such a s**t game and really had no fun with it. Assassin's Creed 2 on the other hand improve with everything about the game in my opinion, the best sequel comeback in gaming! Ezio was a awesome chracter and was way better then Altar. Story is beautiful and very gripping.  Gameplay has improved. Side missions are great and no doing the exact same thing here(unlike theAssassin's Creed 1 was such a s**t game and really had no fun with it. Assassin's Creed 2 on the other hand improve with everything about the game in my opinion, the best sequel comeback in gaming! Ezio was a awesome chracter and was way better then Altar. Story is beautiful and very gripping.  Gameplay has improved. Side missions are great and no doing the exact same thing here(unlike the first game)! Overall a brilliant game and Ubisoft will never make another assassins creed like this again! Assassin's Creed 2 9.5/10\"
